,name,abv,producer,product_category,energy,sugar,price,currency,country,url,images,description,gluten_free,vegan,duplicateWith,percentDuplication,site_name,site_url,seller,extras
1,Run Wild IPA IPA,<0.5%,Athletic Brewing Co.,Beer,65,6 g,16.99,CAD,Canada,https://athleticbrewing.ca/collections/beer/products/run-wild-ipa,https://cdn.shopify.com/s/files/1/0482/1906/2421/files/run-wild-cad.png?v=1703090336,"Run Wild is the ultimate sessionable IPA for craft beer lovers. Brewed with a blend of five Northwest hops, it has an approachable bitterness to balance the specialty malt body. Always refreshing and only 65 calories.📦 Ships to all provinces – Including Quebec",null,Vegan,null,null,athleticbrewing,https://athleticbrewing.ca,seller,"{""fat"":""0 g"",""carbohydrates"":""14 g"",""fibre"":""0 g"",""protein"":""1 g"",""cholesterol"":""0 mg"",""sodium"":""15 mg"",""potassium"":""125 mg"",""calcium"":""20 mg"",""iron"":""0 mg""}"
2,Upside Dawn Pale,<0.5%,Athletic Brewing Co.,Other,45,6 g,16.99,CAD,Canada,https://athleticbrewing.ca/collections/beer/products/upside-dawn-golden,https://cdn.shopify.com/s/files/1/0482/1906/2421/files/upside-ca.png?v=1693920600,"Classic craft Golden style. Refreshing, clean, balanced, and light-bodied. Subtle earthy and spicy notes are balanced with citrusy aromas. Brewed with premium malts and American hops.This product is fermented from grains containing gluten and crafted to remove gluten. The gluten content of this product cannot be verified, and this product may contain gluten.📦 Ships to all provinces – Including Quebec",null,Vegan,null,null,athleticbrewing,https://athleticbrewing.ca,seller,"{""fat"":""0 g"",""carbohydrates"":""10 g"",""fibre"":""0 g"",""protein"":""1g"",""cholesterol"":""0 mg"",""sodium"":""5 mg"",""potassium"":""100 mg"",""calcium"":""10 mg"",""iron"":""0 mg""}"
3,Free Wave IPA,<0.5%,Athletic Brewing Co.,Other,70,6 g,16.99,CAD,Canada,https://athleticbrewing.ca/collections/beer/products/free-wave,https://cdn.shopify.com/s/files/1/0482/1906/2421/files/free-wave-canada.png?v=1684248754,"Free Wave is a hugely hoppy hazy IPA with a juicy body and velvety pour. A trio of Amarillo, Citra and Mosaic hops generate bodacious aromatics of tangerine and grapefruit. Notes of pine and florals emerge in the secondary palate for an herbaceous reprieve in all the right places. It’s luscious, smooth, and highly aromatic.📦 Ships to all provinces – Including Quebec",null,Vegan,null,null,athleticbrewing,https://athleticbrewing.ca,seller,"{""fat"":""0 g"",""carbohydrates"":""16 g"",""fibre"":""0 g"",""protein"":""1 g"",""cholesterol"":""0 mg"",""sodium"":""15 mg"",""potassium"":""150 mg"",""calcium"":""20 mg"",""iron"":""0 mg""}"
4,Athletic Lite Light,<0.5%,Athletic Brewing Co.,Other,25,0 g,16.99,CAD,Canada,https://athleticbrewing.ca/collections/beer/products/athletic-lite,https://cdn.shopify.com/s/files/1/0482/1906/2421/files/lite-cad.png?v=1699890123,"Athletic Lite is a light brew, completely reimagined. It’s classically simple but expertly crafted with 25 calories, 5 carbs, and grains. We brewed it specifically for the sport of life and all the good times that come with it.📦 Ships to all provinces – excluding Quebec",null,Vegan,null,null,athleticbrewing,https://athleticbrewing.ca,seller,"{""fat"":""0 g"",""carbohydrates"":""5 g"",""fibre"":""0 g"",""protein"":""0.2 g"",""cholesterol"":""0 mg"",""sodium"":""5 mg"",""potassium"":""75 mg"",""calcium"":""10 mg"",""iron"":""0 mg""}"
5,Cerveza Atletica Copper,<0.5%,Athletic Brewing Co.,Other,60,3 g,16.99,CAD,Canada,https://athleticbrewing.ca/collections/beer/products/cerveza-atletica,https://cdn.shopify.com/s/files/1/0482/1906/2421/files/cerveza-atletica-canada.png?v=1684248816,"Cerveza Atletica is a refreshing Mexican inspired Light Copper, made with summer time refreshment in mind. A unique blend of Premium Vienna and Munich malts provide a rich copper hue with an aroma and flavour of delicate bread crust that are balanced with light spicy and floral notes from the noble hop, German Hersbrucker. It’s balanced with a dry finish, and pairs perfectly with spicy salsa and fish tacos.📦 Ships to all provinces – excluding Quebec",null,Vegan,null,null,athleticbrewing,https://athleticbrewing.ca,seller,"{""fat"":""0 g"",""carbohydrates"":""14 g"",""fibre"":""0 g"",""protein"":""1 g"",""cholesterol"":""0 mg"",""sodium"":""10 mg"",""potassium"":""100 mg"",""calcium"":""10 mg"",""iron"":""0 mg""}"
6,Fancy Like American Pale,<0.5%,Athletic Brewing Co.,Other,60,5 g,17.99,CAD,Canada,https://athleticbrewing.ca/collections/beer/products/fancy-like,https://cdn.shopify.com/s/files/1/0482/1906/2421/files/main-pdp-image.png?v=1743691603,"Brewed in collaboration with country singer-songwriter Walker Hayes, Fancy Like is a classic American Pale for easy drinkin’ and simple livin’. It’s clean, crisp, and as traditional as they come; what you’d call an American brew, crafted for good times with good people - wherever that may be.📦 Ships to all provinces – excluding Quebec",null,Vegan,null,null,athleticbrewing,https://athleticbrewing.ca,seller,"{""fat"":""0 g"",""carbohydrates"":""12 g"",""fibre"":""0 g"",""protein"":""1 g"",""cholesterol"":""0 mg"",""sodium"":""10 mg"",""potassium"":""75 mg"",""calcium"":""10 mg"",""iron"":""0 mg""}"
7,Blackberry Sour Sour,<0.5%,Athletic Brewing Co.,Other,90,6 g,17.99,CAD,Canada,https://athleticbrewing.ca/collections/beer/products/blackberry-berliner-weisse,https://cdn.shopify.com/s/files/1/0482/1906/2421/files/US_LTO_FruitStand_BlackberrySour_Website_021026_2.png?v=1773149709,"This Blackberry Sour is bursting with berries. Expect a tart punch of blackberry that compliments the soft wheat body of this German-style sour. This brew is part of our Fruit Stand Series, bringing together explosions of fruit and tart goodness all summer long!📦 Ships to all provinces – excluding Quebec",null,Vegan,null,null,athleticbrewing,https://athleticbrewing.ca,seller,"{""fat"":""0 g"",""carbohydrates"":""20 g"",""fibre"":""0 g"",""protein"":""1 g"",""cholesterol"":""0 mg"",""sodium"":""10 mg"",""potassium"":""175 mg"",""calcium"":""10 mg"",""iron"":""0 mg""}"
