id,name,abv,producer,product_category,energy,sugar,price,currency,country,url,images,description,gluten_free,vegan,duplicateWith,percentDuplication,site_name,site_url,seller1
1,NEIPA The Cosmic Turtle - New England IPA,,Below Brew Co.,Other,43kj,0.1g,3.59,GBP,UK,https://belowbrewco.com/collections/beers/products/neipa-the-cosmic-turtle,http://belowbrewco.com/cdn/shop/files/24_OC_BelowBrewCo_NEIPA_ProductImage_Edited_001.png?crop=center&height=1200&v=1733148643&width=1200,"A delicious NEIPA with a huge amount of Citra, Mosaic, Amarillo and El Dorado hops; a crushable, hazy and tropical hop bomb.",,,,,belowbrewco,https://belowbrewco.com,seller
2,Wild Juice Chase - Juicy DDH Pale Ale,,Below Brew Co.,Other,81kj,,3.59,GBP,UK,https://belowbrewco.com/collections/beers/products/wild-juice-chase,http://belowbrewco.com/cdn/shop/files/24_OC_BelowBrewCo_WildJuice_ProductImage_Edited_001.png?crop=center&height=1200&v=1733149029&width=1200,"Talus and Citra hops pair harmoniously with mango and passionfruit to create an exceptional, soft and pillowy Juicy DDH Pale Ale.",,,,,belowbrewco,https://belowbrewco.com,seller
3,Check This Stout - Pastry Stout,,Below Brew Co.,Other,43kj,0.1g,3.59,GBP,UK,https://belowbrewco.com/collections/beers/products/check-this-stout,http://belowbrewco.com/cdn/shop/files/24_OC_BelowBrewCo_Stout_ProductImage_Edited_002.png?crop=center&height=1200&v=1733150058&width=1200,Honeycomb and chocolate come together in this liquid chocolate bar; it’s super decadent and incredibly moreish.,,,,,belowbrewco,https://belowbrewco.com,seller
4,Heaven & Helles (Gluten Free) - Lager,,Below Brew Co.,Other,63kj,0.2g,3.59,GBP,UK,https://belowbrewco.com/collections/beers/products/heaven-helles,http://belowbrewco.com/cdn/shop/files/24_OC_BelowBrewCo_Helles_ProductImage_Edited_001.png?crop=center&height=1200&v=1733148593&width=1200,The classic German hop duo of Tettnanger and Hallertauer Mittelfrüher create a beautiful blend of light floral and herbal aromas in this gluten free helles lager.,Gluten free,,,,belowbrewco,https://belowbrewco.com,seller
5,Forgot To Take My Pils - Hoppy Pilsner,,Below Brew Co.,Other,92kj,3g,3.59,GBP,UK,https://belowbrewco.com/collections/beers/products/forgot-to-take-my-pils,http://belowbrewco.com/cdn/shop/files/24_OC_BelowBrewCo_Pils_ProductImage_Edited_001.png?crop=center&height=1200&v=1733148532&width=1200,"Old school hops meet new school drops: Saaz, Perle, Hallertau Blanc & Mandarina Bavaria combine in this wonderfully crisp and refreshing pilsner.",,,,,belowbrewco,https://belowbrewco.com,seller
6,All Hopped Up - IPA,,Below Brew Co.,Other,75kj,0.4g,3.59,GBP,UK,https://belowbrewco.com/collections/beers/products/all-hopped-up-ipa,http://belowbrewco.com/cdn/shop/files/24_OC_BelowBrewCo_IPA_ProductImage_Edited_001.png?crop=center&height=1200&v=1733320038&width=1200,"A BIG IPA with flavours of grapefruit, mango and papaya with a piney finish. We’ve smashed it full of Citra Lupomax, Citra Dynaboost, Idaho 7 CGX and a splash of Amarillo.",,,,,belowbrewco,https://belowbrewco.com,seller
7,Unruly AF - Pale Ale,,Below Brew Co.,Other,82kj,0.3g,3.85,GBP,UK,https://belowbrewco.com/collections/beers/products/unruly-af-pale,http://belowbrewco.com/cdn/shop/files/24_OC_BelowBrewCo_Unruly_ProductImage_Edited_001.png?crop=center&height=1200&v=1733148927&width=1200,"Brewed with top-of-the-hops trio, Citra, Mosaic, and Idaho 7. All the fresh hoppy flavours with notes of citrusy peach ice tea.",,,,,belowbrewco,https://belowbrewco.com,seller
