name,abv,producer,product_category,energy,sugar,price,currency,country,url,images,description,gluten_free,vegan,duplicateWith,percentDuplication,site_name,site_url,seller,extras
1,Hidcote Blue Organic Alkoholfri 0%,<0.5% ABV,København Kombucha,Kombucha,null,null,159.95,DKK,Denmark,https://www.hjhansen-vin.dk/bobler/mousserende-te/hidcote-blue-organic-alkoholfri-0-koebenhavn-kombucha,"[""https://mediacache.hjhansen-vin.dk/v-639099627863404792/b9/98/f8e4-c5b6-44f1-95d4-3ac21d010f66/903164_Hidcote%20Blue%20non%20Alcoholic%20Organic_K%C3%B8benhavn%20Kombucha.png""]","Prøv København Kombuchas bedst sælgende kombucha – en prisvindende variant tilsat økologisk Hidcote Blue-lavendel. Denne elegante kombucha har vundet den anerkendte ""Sol over Gudhjem""-pris for sin unikke balance mellem blomstrede aromaer, en livlig syre og cremet mundfornemmelse. Den komplekse gæringsprofil gør denne kombucha til et oplagt valg sammen med umami-rige og røgede retter, som grillede tomater, aubergine, svinekød og fjerkræ. Serveres optimalt ved 8 °C – præcis som en god champagne. Alle ingredienser er økologiske, og produktet er 100 % vegansk.",null,Vegan,null,null,hjhansen-vin,https://www.hjhansen-vin.dk,seller,"{""size"":""75 cl""}"
2,Rosa Rugosa Organic Alkoholfri 0%,<0.5% ABV,København Kombucha,Other,null,null,159.95,DKK,Denmark,https://www.hjhansen-vin.dk/bobler/mousserende-te/rosa-rugosa-organic-alkoholfri-0-koebenhavn-kombucha,"[""https://mediacache.hjhansen-vin.dk/v-639100785210053119/8b/11/1980-83a2-411e-b935-aca6c42e7843/903290_Rosa%20Rugosa%20Non%20Alcoholic%20Organic_K%C3%B8benhavn%20Kombucha.png""]","Oplev de unikke Rosa Rugosa-blomster, dyrket med omhu på en specialiseret gård i Finland. Denne særlige hybenrose er kendt for sin rige blomsterduft og intense bæraroma, hvilket gør den til et perfekt valg til både desserter, osteanretninger og som en forfriskende apéritif. Rosa Rugosa passer ideelt til alle slags bærbaserede desserter og giver en skøn, cremet konsistens med noter af hyben, der fremhæver smagen af fx jordbær, hindbær og blåbær. Den bløde, søde finish gør den også til en fantastisk ledsager til lagrede oste og blåskimmeloste – og ikke mindst til en klassisk vaniljeis. Ligesom champagne er den ideelle serveringstemperatur 8 °C. Alle ingredienser er økologiske.",null,null,null,null,hjhansen-vin,https://www.hjhansen-vin.dk,seller,"{""size"":""75 cl""}"
3,"Mionetto Aperitivo Alkoholfri 0,0%, 50 cl",0.0%,Mionetto,Other,null,null,129.95,DKK,Denmark,https://www.hjhansen-vin.dk/andre-vintyper/alkoholfri/mionetto-aperitivo-alkoholfri-00-50-cl-mionetto,"[""https://mediacache.hjhansen-vin.dk/v-639098210939103136/e7/34/022b-76d6-4c27-b78a-aa4ebc9e7595/29266308_Mionetto%20Aperitivo%20Alcohol%20Free%2C%2050%20cl%2C%20Mionetto_HIGH.png""]","Original italiensk alkoholfri aperitivo med 100% naturlige smagsnoter af sødmefuld appelsin og lakrids, den friske syrlighed fra citrusfrugt og bitterhed fra ​forskellige urter og rødder.",null,null,null,null,hjhansen-vin,https://www.hjhansen-vin.dk,seller,"{""size"":""50 cl""}"
4,"Natureo Rose Alkoholfri 0,0%",0.0%,Miguel Torres,Other,null,null,79.95,DKK,Denmark,https://www.hjhansen-vin.dk/andre-vintyper/alkoholfri/natureo-rose-alkoholfri-00-miguel-torres,"[""https://mediacache.hjhansen-vin.dk/v-639098204321972262/8e/27/5a16-4185-4796-853a-641cff495a88/10548609_Natureo%20Rose%20Alkoholfri%20Torres_HIGH_NY.png""]","Natureo-serien er udviklet via en helt speciel teknik med omvendt osmose, der frafiltrerer alkoholen uden at ødelægge den autentiske vinsmag! ""Vinene"" er frugtrige og fyldige med fin, meget svag sødme. Eminent til dem, der gerne vil nyde et godt glas vin uden at få alkoholen med, eller til frokostmøder, der kræver, at hovedet fortsat holdes klart! Teknikken bag: Når den normale gæring er overstået, gennemgår vinen af-alkoliserings proces i en såkaldt spinning column: Vinen frafiltreres sine aromabærende tørstoffer, hvilket udgør cirka 1 % af væsken, og køres igennem en spinning column hvor vinen langsomt passerer ned gennem tanken via hyldelignende metalplader, som sidder på tankens inderside. Tanken er sat under tryk, og en varm damp stiger gennem denne fra bunden. Alkoholen dampes ud af vinen, og den nu smags- og alkoholløse væske passerer ud af tankbunden. Processen tager cirka 20 sekunder, og der kan renses mellem 60 og 160 liter vin pr. min. Væsken tilsættes nu igen aromastofferne, hvorefter den kan tappes på flaske og sælges som alkoholfri vin.",null,null,null,null,hjhansen-vin,https://www.hjhansen-vin.dk,seller,"{""size"":""75 cl""}"
5,"Pierre Zero Spritz Sparkling Alkoholfri 0,0%",0.0%,Domaines Pierre Chavin,Other,null,null,119.95pr. stk,DKK,Denmark,https://www.hjhansen-vin.dk/andre-vintyper/alkoholfri/pierre-zero-spritz-sparkling-alkoholfri-00-domaines-pierre-chavin,"[""https://mediacache.hjhansen-vin.dk/v-639100287159009295/00/4a/ffab-62ce-4592-aa4d-11fb454d7d05/17907509_Pierre%20Zero%20Spritz%20Sparkling%20Non-Alcholic%2C%20Domaines%20Pierre%20Chavin_HIGH.png""]","Pierre Zéro Spritz har sine rødder i det solrige Languedoc-Roussillon i det sydlige Frankrig, hvor druerne høstes om natten for at bevare friskhed og aroma. Områdets varme klima og kalkholdige jordbund giver druerne en naturlig sødme og intensitet, som er essentiel for at skabe en aromatisk og balanceret alkoholfri vin.",null,null,null,null,hjhansen-vin,https://www.hjhansen-vin.dk,seller,"{""size"":""75 cl""}"
6,"Mionetto Sparkling Alkoholfri 0,0%",0.0%,Mionetto,Other,null,null,99.95,DKK,Denmark,https://www.hjhansen-vin.dk/andre-vintyper/alkoholfri/mionetto-sparkling-alkoholfri-00-mionetto,"[""https://mediacache.hjhansen-vin.dk/v-639100122632088211/17/e8/b934-5ce9-4d43-911d-63e8be5964f9/10563309_Mionetto%20Alcohol%20Free%20Sparkling%2C%20Mionetto_HIGH.png""]",Nyd den autentiske italienske smag af prosecco - helt uden alkohol. Lavet på udvalgte Glera-druer med al proseccoens typiske friskhed og frugtige noter.,null,null,null,null,hjhansen-vin,https://www.hjhansen-vin.dk,seller,"{""size"":""75 cl""}"
