id,name,abv,producer,product_category,energy,sugar,price,currency,country,url,images,description,gluten_free,vegan,duplicateWith,percentDuplication,site_name,site_url,seller1
1,Seedlip Grove 42,,Seedlip,Other,,,31.99,USD,USA,https://www.seedlipdrinks.com/en-us/shop/seedlip-grove-42,https://images.ctfassets.net/5b666rpws7o7/1EOJ7D2ePSx4iU9Vaefxjk/b5446c00b1bbf29405620dc9f3221544/Grove_42_bottle.png,"Cultivated from a trio of bitter peel, lemon, and blood oranges. A sophisticated, bright, citrus blend of Mediterranean Orange, Lemon, Lemongrass and Ginger with a dry finish. 1 x 23.7 fl oz / 700 ml bottle.",,,,,seedlipdrinks,https://www.seedlipdrinks.com,seller
2,Seedlip Spice 94,,Seedlip,Other,,,31.99,USD,USA,https://www.seedlipdrinks.com/en-us/shop/seedlip-spice-94,https://images.ctfassets.net/5b666rpws7o7/4csivoKQhyQWjGSxx0JplL/4f1ebb3d5cd90559a81dbab179f47496/Seedlip_Spice_94.png,"Inspired by the deep woods and the spiced aroma of the forest floor. A warm, aromatic blend of allspice & cardamom with citrus top notes to balance the long bitter finish. 1 x 23.7 fl oz / 700 ml bottle.",,,,,seedlipdrinks,https://www.seedlipdrinks.com,seller
3,Seedlip Garden 108,,Seedlip,Other,,,31.99,USD,USA,https://www.seedlipdrinks.com/en-us/shop/seedlip-garden-108,https://images.ctfassets.net/5b666rpws7o7/3LGQyxfgNI8vHXIGzeyDqO/d787ef91eee0a59e5b87a185619a751c/garden_108.png,"Rooted in memories eating fresh peas straight from the pod. A complex, herbal blend of peas & traditional garden herbs including rosemary, thyme & spearmint. 1 x 23.7 fl oz / 700 ml bottle.",,,,,seedlipdrinks,https://www.seedlipdrinks.com,seller
4,Seedlip Trio,,Seedlip,Other,,,89.00,USD,USA,https://www.seedlipdrinks.com/en-us/shop/seedlip-special-offer-trio,https://images.ctfassets.net/5b666rpws7o7/6O2VZdqYFPnGGId6cMxqng/4ffc9d618b7ec99b994de2213ec2d0a5/Untitled_design.png,"The Seedlip Special Offer Trio is a perfect way to explore the full Seedlip range in the comfort of your own home. Discover the aromatic Spice 94, the fresh & herbal Garden 108 & the citrus Grove 42.",,,,,seedlipdrinks,https://www.seedlipdrinks.com,seller
5,The Seedlip Recipe Bundle,,Seedlip,Other,,,99.00,USD,USA,https://www.seedlipdrinks.com/en-us/shop/the-seedlip-recipe-bundle,https://images.ctfassets.net/5b666rpws7o7/4L8ktWMDAefr92ua65MqJC/9fd8e5944e9ba994699c466b170324a7/S8_Products_Book_Bottles__1_.jpg,All three Seedlip expressions and our recently released cocktail book.,,,,,seedlipdrinks,https://www.seedlipdrinks.com,seller
6,Non-Alcoholic Cocktail Recipe Book,,Seedlip,Other,,,20.00,USD,USA,https://www.seedlipdrinks.com/en-us/shop/seedlip-cocktail-book,https://images.ctfassets.net/5b666rpws7o7/3PK6cGoJcIxdvHAHHXiQBs/9545f830f8d8daaeba34a4c4c3779425/S8_Products_Cocktail_Book.jpg,"An exclusive collection of Seedlip’s finest cocktails, insight into their ethos, technique and ingredients. Highly illustrated, with recipes from the world’s best bartenders and images by photographer Rob Lawson.",,,,,seedlipdrinks,https://www.seedlipdrinks.com,seller
