name,abv,producer,product_category,energy,sugar,price,currency,country,url,images,description,gluten_free,vegan,duplicateWith,percentDuplication,site_name,site_url,seller,extras
1,Non-Alcoholic Sparkling Rosé Can 4-Pack,<0.5% ABV,Surely,Wine,40 cals,3gg,24.99,USD,USA,https://www.drinksurely.com/products/non-alcoholic-sparkling-rose-can,http://www.drinksurely.com/cdn/shop/files/10_offandfreeshippingwhenyoubuy2_38.png?v=1686873121,"Bursting with delicate fruit flavors of guava, strawberry and kiwi, this refreshing Sparkling Rosé will take you back to your favorite warm weather memories. An easy drinker for a wine newbie or a connoisseur.",Gluten free,null,null,null,drinksurely,https://www.drinksurely.com,seller,"{""composition"":""The same delicious wine you find in the Sparkling Rosé 750mL bottle. Wine = De-alcoholized Rosé Fruit = Peach Sweetness = Naturally occurring Ingredients: De-alcoholized Rosé Wine, Water, Peach Concentrate, Sauvignon Blanc Concentrate, Gum Arabic, Sulfites (Preservative).""}"
2,Non-Alcoholic Brut Can 4-Pack,<0.5% ABV,Surely,Wine,30 cals,3gg,24.99,USD,USA,https://www.drinksurely.com/products/non-alcoholic-brut-wine-cans,http://www.drinksurely.com/cdn/shop/files/10_offandfreeshippingwhenyoubuy2_34.png?v=1686873360,"A bold but pleasant Brut wine for any time of day. Not too dry, not too sweet. Hints of lemon, peach and custard keep your tastebuds craving more. Best enjoyed at dinner with Ciara and Russell or at home lounging in Chrissy Teigen’s butter robe",Gluten free,null,null,null,drinksurely,https://www.drinksurely.com,seller,"{""composition"":""The same delicious wine you find in the Brut 750mL bottle. Wine = De-alcoholized White Wine Fruit = Peach Sweetness = Naturally occurring Ingredients: De-alcoholized White Wine, Water, Sauvignon Blanc Concentrate, Peach Concentrate, Gum Arabic, Sulfites (Preservative).""}"
3,Non-Alcoholic Bubbly Red Can 4-Pack,<0.5% ABV,Surely,Wine,35 calories,4gg,24.99,USD,USA,https://www.drinksurely.com/products/non-alcoholic-bubbly-red-cabernet-pinot-noir,http://www.drinksurely.com/cdn/shop/files/10_offandfreeshippingwhenyoubuy2_36.png?v=1685143085,"A full bodied non-alcoholic red wine for any occasion. Our Non-alcoholic Pinot Noir has smooth velvety tannins with lovely notes of cranberry, plum and blackberry. Well rounded in terms of tannins, fruit and acid ratio. The perfect wine for any crowd.",null,null,null,null,drinksurely,https://www.drinksurely.com,seller,"{""composition"":""Wine = 75% Cabernet and 25% Pinot Noir Fruit = Dark Sweet Cherry Sweetness = Naturally occuring, no added sugar 4g/serv Ingredients: De-alcoholized Red Wine Blend, Water, Cherry Concentrate, White Grape Concentrate, Natural Flavors, Carbon Dioxide, Sulfites (preservative).""}"
4,Non-Alcoholic Sauvignon Blanc,0.5% ABV,Surely,Wine,20 cals,2gg,22.99,USD,USA,https://www.drinksurely.com/products/non-alcoholic-sauvignon-blanc-wine,http://www.drinksurely.com/cdn/shop/products/AWARDS_SAUVBLANC.png?v=1669100647,"Surely alcohol-removed Sauvignon Blanc with soft notes of pear, apple and lemon. Crisp, clean and bright. 0.5% ABV white wine.",null,null,null,null,drinksurely,https://www.drinksurely.com,seller,"{""composition"":""Wine = De-alcoholized Sauvignon Blanc Fruit = Peach Sweetness = Naturally occurring Ingredients: Dealcoholized Sauvignon Blanc Wine, Water, Sauvignon Blanc Concentrate, Peach Concentrate, Gum Arabic, Natural Flavors, Sulfites (Preservative).""}"
5,Non-Alcoholic Sparkling Rosé,<0.5% ABV,Surely,Other,25 cals,2gg,24.99,USD,USA,https://www.drinksurely.com/products/sparkling-nonalcoholic-rose,http://www.drinksurely.com/cdn/shop/products/AWARDS_SPARKROSE.png?v=1669099467,"Surely alcohol-removed sparkling rosé has crisp, light notes of strawberry, pear, and tropical fruit balanced with a light acid for a full finish.",null,null,Non-Alcoholic Sparkling Rosé Can 4-Pack,82.03389830508475,drinksurely,https://www.drinksurely.com,seller,"{""composition"":""Wine = De-alcoholized Rosé Fruit = Peach Sweetness = Naturally occurring Ingredients: De-alcoholized Rosé Wine, Water, Peach Concentrate, Sauvignon Blanc Concentrate, Gum Arabic, Sulfites (Preservative).""}"
6,Non-Alcoholic Sparkling Brut,<0.5% ABV,Surely,Wine,15 cals,2gg,24.99,USD,USA,https://www.drinksurely.com/products/non-alcoholic-sparkling-white-wine,http://www.drinksurely.com/cdn/shop/files/1_38cb281e-6cf4-4ecd-a819-225d51497820.png?v=1701450526,This sparkling non-alcoholic white wine tastes just like the real thing. Perfect for late night drinks and hangover-free mornings.,null,null,Non-Alcoholic Sparkling Rosé,81.4,drinksurely,https://www.drinksurely.com,seller,"{""composition"":""Wine = De-alcoholized White Wine Fruit = Peach Sweetness = Naturally occurring Ingredients: De-alcoholized White Wine, Water, Sauvignon Blanc Concentrate, Peach Concentrate, Gum Arabic, Sulfites (Preservative)""}"
7,Non-Alcoholic Red Blend,<0.5% ABV,Surely,Other,null,5gg,24.99,USD,USA,https://www.drinksurely.com/products/non-alcoholic-red-blend,http://www.drinksurely.com/cdn/shop/files/Surely_RedBlend_Mockup_Front.png?v=1757584001,"A complex, smoky, & layered NA red unlike any other. Dark fruit meets smooth vanilla, rich oak, smoke & spice. Not a varietal. A completely unique sip.",null,null,null,null,drinksurely,https://www.drinksurely.com,seller,"{""composition"":""Grapes: We chose a blend of premium, locally-sourced Cabernet Sauvignon & Petite Sirah. Cabernet Sauvignon was chosen for its fresh dark fruit character and Petite Sirah for its bold tannins and spicy finish. Oak character: We added a blend of French and American Oak to smooth out the tannins and deliver a velvety vanilla flavor. Earthiness: Feeling that we needed more body we incorporated a tea blend to round out the mouthfeel. Puerh Tea, a fermented tea, was specifically used to add a layer of “earthiness” and Lapsang Souchong was chosen to compliment the spice of the Petite Sirah. Balance: The addition of premium cocoa mostly interplays with the wine and the oak to provide balance.""}"
