id,name,abv,producer,product_category,energy,sugar,price,currency,country,url,images,description,gluten_free,vegan,duplicateWith,percentDuplication,site_name,site_url,seller1
35,FLORENTINA Bellini - Sparkling non-alcoholic beverage 750ml,0%,Florentina,Wine,,7.5g,8.5,EUR,France,https://shop.pierre-chavin.com/en/pierre-chavin/342-florentina-bellini-sparkling-non-alcoholic-beverage-750ml.html,https://shop.pierre-chavin.com/2451-large_default/florentina-bellini-sparkling-non-alcoholic-beverage-750ml.jpg,"Florentina 0% Bellini, organic non-alcoholic sparkling wine, reveals delicate bubbles that are both fine and persistent. The color is pale yellow with brilliant and silvery reflections. The nose has crisp peach aromas. The palate features a creamy and caressing mousse, revealing notes of peach, with an unmatched freshness.",,,,,pierre-chavin,https://shop.pierre-chavin.com,seller
36,FLORENTINA Red Fruits - Non-alcoholic sparkling beverage 750ml,0%,Florentina,Other,,7.5g,8.5,EUR,France,https://shop.pierre-chavin.com/en/pierre-chavin/343-florentina-red-fruits-non-alcoholic-sparkling-beverage-750ml.html,https://shop.pierre-chavin.com/2093-large_default/florentina-red-fruits-non-alcoholic-sparkling-beverage-750ml.jpg,"Florentina 0% red fruits, organic non-alcoholic sparkling, reveals delicate bubbles that are both fine and persistent. The color is a pale red with brilliant reflections. The nose has crisp aromas of blackberries, blueberries, and raspberries. The palate presents a creamy and caressing mousse, revealing notes of blackberries, blueberries, and raspberries, with an unmatched complexity.",,,,,pierre-chavin,https://shop.pierre-chavin.com,seller
37,"PACK FLORENTINA Peach, Red Fruits & Spritz - Sparkling Non-Alcoholic Beverage 3x750ml",0%,Florentina,Other,,,24,EUR,France,https://shop.pierre-chavin.com/en/pierre-chavin/363-pack-florentina-peach-red-fruits-spritz-sparkling-non-alcoholic-beverage-3x750ml.html,https://shop.pierre-chavin.com/2465-large_default/pack-florentina-peach-red-fruits-spritz-sparkling-non-alcoholic-beverage-3x750ml.jpg,"New: Discover Florentina Peach, Red Fruits &amp; Spritz our new 100% organic and sulfite-free range! The pack includes: 1 bottle of Florentina Peach 1 bottle of Florentina Red fruits 1 bottle of Florentina Spritz",,,,,pierre-chavin,https://shop.pierre-chavin.com,seller
38,Pack PIERRE ZERO SIGNATURE Tasting - Non-alcoholic Beverage - 2x750ml,,Pierre Zéro,Other,,,27,EUR,France,https://shop.pierre-chavin.com/en/alcohol-free-wine-collection/380-pack-pierre-zero-signature-tasting-non-alcoholic-beverage-2x750ml.html,https://shop.pierre-chavin.com/2157-large_default/pack-pierre-zero-signature-tasting-non-alcoholic-beverage-2x750ml.jpg,"The promise of Pierre Zéro: benefits and aromas. With this tasting pack, we offer you the chance to discover our premium range Pierre Zéro Signature, which perfectly complements the Pierre Zéro range. To be enjoyed without moderation! (non-contractual visuals)",,,,,pierre-chavin,https://shop.pierre-chavin.com,seller
39,copy of CHAVIN ZERO Cabernet & Merlot - Dealcoholized Wine - 750ml,0%,Chavin Zéro,Wine,,,14.9,EUR,France,https://shop.pierre-chavin.com/en/pierre-chavin/439-copy-of-chavin-zero-cabernet-merlot-dealcoholized-wine-750ml.html,https://shop.pierre-chavin.com/2640-large_default/copy-of-chavin-zero-cabernet-merlot-dealcoholized-wine-750ml.jpg,"Chavin Zéro launches its first range of de-alcoholized Vin De France, merging innovation and French winemaking tradition. Treat yourself to a unique experience if you're looking to savor wine without the effects of alcohol, while preserving the complex nuances and authentic aromas of a selection of French grape varieties. With low-calorie options and no added flavors, Chavin Zéro revolutionizes wine tasting, making moderation and sensory experience possible.",,,CHAVIN ZERO Cabernet & Merlot - Dealcoholized Wine - 750ml,89.99999999999999,pierre-chavin,https://shop.pierre-chavin.com,seller
40,Pack PIERRE ZERO SIGNATURE EFFERVESCENT Tasting - Non-alcoholic Beverage - 2x750ml,,Pierre Zéro,Other,,,37,EUR,France,https://shop.pierre-chavin.com/en/alcohol-free-wine-collection/381-pack-pierre-zero-signature-effervescent-tasting-non-alcoholic-beverage-2x750ml.html,https://shop.pierre-chavin.com/2618-large_default/pack-pierre-zero-signature-effervescent-tasting-non-alcoholic-beverage-2x750ml.jpg,"The promise of Pierre Zéro: benefits and aromas. With this tasting pack, we invite you to discover our premium range Pierre Zéro Signature, which perfectly complements the Pierre Zéro range. The Pierre Zéro Signature Sparkling White reveals mineral aromas and brioche notes with hints of tangy fruits, citrus, and apples, while the Pierre Zéro Signature Sparkling Rosé offers a delicately fruity palate and a pale pink color dotted with fine and delicate bubbles. To be enjoyed without moderation!",,,Pack PIERRE ZERO SIGNATURE Tasting - Non-alcoholic Beverage - 2x750ml,80.84615384615385,pierre-chavin,https://shop.pierre-chavin.com,seller