id,name,abv,producer,product_category,energy,sugar,price,currency,country,url,images,description,gluten_free,vegan,duplicateWith,percentDuplication,site_name,site_url,seller
1,Guinness 0.0 Zero Pint - Alcohol Free Stout,0.5%,Guinness,Other,,,16.98,GBP,UK,https://drydrinker.com/products/guinness-0-0-pint-cans-alcohol-free-guinness-stout,http://drydrinker.com/cdn/shop/files/1000px-Guinness0-0-AlcoholFreeGuinnessStout-PintCans_5ea157dc-313f-4f71-af1f-e3f435892a71.png?v=1752232597&width=2048,"Guinness 0.0% ABV. Irish alcohol free stout with roasted malt, coffee and chocolate flavour.",,,,,drydrinker,https://drydrinker.com,seller
2,No and Low Alcohol Beer Discovery Subscription,0.5%,Dry Drinker,Beer,,,21.50,GBP,UK,https://drydrinker.com/products/dry-drinkers-beer-discovery-box,http://drydrinker.com/cdn/shop/files/BeerDiscovery-2025.jpg?v=1761143930&width=2048,"A handpicked collection of the best alcohol-free beers, featuring craft lagers, IPAs, and stouts.",,,,,drydrinker,https://drydrinker.com,seller
3,Darling Cellars Shiraz - Non Alcoholic Red Wine,0.5%,Darling Cellars,Wine,-,3.53g,7.92,GBP,UK,https://drydrinker.com/products/dc-red-shiraz-0-5-low-alcohol-wine-3-or-6-case-size,http://drydrinker.com/cdn/shop/files/1000px-DCRedShiraz-NonAlcoholicRedWine_0482fade-c3d6-4650-b25a-c57ea766359e.png?v=1752232586&width=2048,Darling Cellars Shiraz 0.5% ABV. South African non alcoholic red wine with blackberry and spice notes.,,,,,drydrinker,https://drydrinker.com,seller
4,Maisel's Weisse - Non Alcoholic Wheat Beer,0.5%,Maisels,Beer,26 kcal,2.0g,16.27,GBP,UK,https://drydrinker.com/products/maisel-s-weisse-wheat-beer-0-5-low-alcohol-beer-8-12-x-500ml,http://drydrinker.com/cdn/shop/files/1000px-MaiselsWeisseWheatBeer-NonAlcoholicGermanBeer_0b847b54-bac3-441d-a4c4-2b774ef8f54f.png?v=1752232624&width=2048,Maisel's Weisse 0.5% ABV. German non alcoholic wheat beer with banana and clove yeast notes.,,,,,drydrinker,https://drydrinker.com,seller
5,Zeno Red - Non Alcoholic Red Wine,0.5%,Zeno,Wine,42kj/10kcal,2.1g,13.75,GBP,UK,https://drydrinker.com/products/copy-of-zeno-alcohol-liberated-red-wine,http://drydrinker.com/cdn/shop/files/zeno-red.png?v=1752232582&width=2048,Zeno Red 0.3% ABV. Spanish non alcoholic red wine with cherry and plum flavour.,,,,,drydrinker,https://drydrinker.com,seller
6,Athletic Brewing Upside Dawn - Non Alcoholic Golden Ale,0.5%,Athletic,Other,54kJ/13kcal,1.8g,15.19,GBP,UK,https://drydrinker.com/products/athletic-brewing-upside-dawn-low-alcohol-ale-0-5-8-16-24-x-355ml,http://drydrinker.com/cdn/shop/files/1000px-athletic-brewing-upside-dawn-alcohol-free-golden-ale_40037f76-2fea-4cd8-a908-6b7ccaef92e4.png?v=1752232556&width=2048,Upside Dawn by Athletic Brewing. &lt;0.5% ABV golden ale with floral hops and biscuit malt. Vegan friendly.,,Vegan,,,drydrinker,https://drydrinker.com,seller
7,Thatchers Zero - Non Alcoholic Cider,0.5%,Thatchers,Cider,107kJ/25kcal,5.2g,22.95,GBP,UK,https://drydrinker.com/products/thatchers-zero-cider-0-0-alcohol-free-cider-8-12-x-500ml,http://drydrinker.com/cdn/shop/files/thatchers-march-2025.png?v=1752232664&width=2048,Thatchers Zero. English alcohol free cider with crisp apple flavour.,,,,,drydrinker,https://drydrinker.com,seller
8,St Austell Proper Job - Non Alcoholic IPA,0.5%,St Austell,Other,,,16.74,GBP,UK,https://drydrinker.com/products/st-austell-proper-job-ipa-non-alcoholic-ipa,http://drydrinker.com/cdn/shop/files/Website1000pxTransparentProductImageTemplate_11_a0db51a4-5c15-4e19-992d-770f254fa571.png?v=1752232661&width=2048,St Austell Proper Job 0.5% ABV. Cornish non alcoholic IPA with citrus and pine hops.,,,,,drydrinker,https://drydrinker.com,seller
9,Clausthaler Dry Hopped - Non Alcoholic Lager,0.5%,Clausthaler,Other,108 kJ/26 kcal,2.8g,10.80,GBP,UK,https://drydrinker.com/products/clausthaler-unfiltered-0-5-low-alcohol-beer-8-12-x-330ml,http://drydrinker.com/cdn/shop/files/dry-hopped.jpg?v=1753967919&width=2048,Clausthaler Dry Hopped 0.5% ABV. German non alcoholic lager with citrus and pine hop flavour.,,,,,drydrinker,https://drydrinker.com,seller
10,Drop Bear Yuzu - Non Alcoholic Pale Ale,0.5%,Drop Bear,Other,,,13.50,GBP,UK,https://drydrinker.com/products/drop-bear-yuzu-pale-ale-gluten-free-0-5-8-16-24-x-330ml-cans,http://drydrinker.com/cdn/shop/files/drop-beer-yuzu.jpg?v=1757414176&width=2048,Drop Bear Yuzu Pale Ale 0.5% ABV. Non alcoholic pale ale brewed with Japanese yuzu fruit.,,,,,drydrinker,https://drydrinker.com,seller
11,Kehrwieder ü.NN India Pale Ale - Non Alcoholic IPA,0.5%,Kehrwieder,Other,32kcal,3.4g,19.38,GBP,UK,https://drydrinker.com/products/unn-india-pale-ale-0-5-low-alcohol-beer-8-12-x-330ml,http://drydrinker.com/cdn/shop/files/1000px-Kehrwieder_u.NN_India_Pale_Ale_-_Non_Alcoholic_IPA_d53242dd-5213-46ad-8699-20888c4bcddf.png?v=1752232672&width=2048,Kehrwieder ü.NN IPA 0.4% ABV. German non alcoholic IPA with citrus and tropical hop notes.,,,,,drydrinker,https://drydrinker.com,seller
12,Guinness 0.0 Zero 440ml - Alcohol Free Stout,0.5%,Guinness,Other,,,13.51,GBP,UK,https://drydrinker.com/products/guinness-0-0-zero-440ml-alcohol-free-stout,http://drydrinker.com/cdn/shop/files/1000px-Guinness0-0-AlcoholFreeGuinnessStout-PintCans_5ea157dc-313f-4f71-af1f-e3f435892a71.png?v=1752232597&width=2048,"Guinness 0.0% ABV. Irish alcohol free stout with roasted malt, coffee and chocolate flavour.",,,Guinness 0.0 Zero Pint - Alcohol Free Stout,81.83098591549296,drydrinker,https://drydrinker.com,seller
13,Jump Ship Yardarm - Non Alcoholic Lager,0.5%,JumpShip,Other,40kcal,1.0g,17.70,GBP,UK,https://drydrinker.com/products/jump-ship-yardarm-lager-0-5-gluten-free-low-alcohol-beer-8-16-24-x-330ml,http://drydrinker.com/cdn/shop/files/1000px-Jump_Ship_Yardarm_-_Non_Alcoholic_Lager_a52796a9-a842-4485-83ba-c927fd0079cb.png?v=1752232606&width=2048,Jump Ship Yardarm 0.5% ABV. Scottish non alcoholic lager with crisp malt and floral hops.,,,,,drydrinker,https://drydrinker.com,seller
14,Darling Cellars Sauvignon Blanc - Non Alcoholic White Wine,0.5%,Darling Cellars,Wine,-,3.53g,7.92,GBP,UK,https://drydrinker.com/products/dc-sauvignon-blanc-0-5-low-alcohol-wine-3-or-6-bottles,http://drydrinker.com/cdn/shop/files/1000px-DarlingCellarsSauvignonBlanc-DealcoholisedWhiteWine_4d2b6d68-798c-4e24-8939-dacfa524068d.png?v=1752232587&width=2048,Darling Cellars Sauvignon Blanc 0.5% ABV. South African non alcoholic white wine with citrus and gooseberry notes.,,,,,drydrinker,https://drydrinker.com,seller
15,Torres Natureo Garnacha Syrah Natureo - Alcohol Free Red Wine,0.5%,Torres,Wine,32kcal,3.6g,9.41,GBP,UK,https://drydrinker.com/products/spanish-dry-torres-2020-garnacha-syrah-natureo-0-0-alcohol-free-wine-750ml-3-or-6-case-size,http://drydrinker.com/cdn/shop/files/1000px-SpanishDryTorres2021GarnachaSyrahNatureo-AlcoholFreeRedWine_7fdaabf9-9d3d-4c4f-9207-f88788ff5ab1.png?v=1752232658&width=2048,Torres Natureo Garnacha Syrah 0.0% ABV. Spanish alcohol free red wine with cherry and spice notes.,,,,,drydrinker,https://drydrinker.com,seller
16,Athletic Brewing Run Wild - Non Alcoholic IPA,0.5%,Athletic,Other,71kJ/17kcal,1.8g,15.19,GBP,UK,https://drydrinker.com/products/athletic-brewing-run-wild-ipa-0-5-low-alcohol-beer-8-16-24-x-355ml,http://drydrinker.com/cdn/shop/files/run-wild.jpg?v=1753968388&width=2048,Athletic Brewing Run Wild IPA. &lt;0.5% ABV non alcoholic IPA with citrus and pine hop character.,,,,,drydrinker,https://drydrinker.com,seller
17,Oddbird Blanc de Blancs - Non Alcoholic Sparkling White Wine,0.5%,Oddbird,Wine,18kcal,4.5g,14.53,GBP,UK,https://drydrinker.com/products/oddbird-blanc-de-blancs-sparkling-wine-750ml-non-alcoholic-wine-3-or-6-case-size,http://drydrinker.com/cdn/shop/files/1000px-Oddbird_Blanc_de_Blancs_-_Alcohol_Free_Sparkling_Wine_a55bc68d-7f2e-4a71-bcb3-fb49e341ebed.png?v=1752232642&width=2048,Oddbird Blanc de Blancs 0.0% ABV. Swedish non alcoholic sparkling white wine with citrus and apple notes.,,,,,drydrinker,https://drydrinker.com,seller
18,Big Drop Paradiso Citra - Non Alcoholic Pale Ale Can,0.5%,Big Drop,Other,13kJ/3kcal,<0.5g,15.33,GBP,UK,https://drydrinker.com/products/big-drop-paradiso-citra-gluten-free-pale-ale-0-5-low-alcohol-beer-8-16-24-x-330ml,http://drydrinker.com/cdn/shop/files/big-para.png?v=1752232565&width=2048,Big Drop Paradiso Citra Pale Ale 0.5% ABV. UK non alcoholic pale ale with citrus and tropical hop flavour.,,,,,drydrinker,https://drydrinker.com,seller
19,Free Damm Bottles - Alcohol Free Lager,0.5%,Free Damm,Other,,,13.56,GBP,UK,https://drydrinker.com/products/free-damm-bottles-alcohol-free-lager,http://drydrinker.com/cdn/shop/files/1000px-FreeDammBottles-AlcoholFreeLager_a4241fef-8fbe-4dcb-b844-1e3707f5c380.png?v=1752232595&width=2048,Free Damm 0.0% ABV. Spanish alcohol free lager bottles with crisp malt and floral hops.,,,,,drydrinker,https://drydrinker.com,seller
20,Erdinger Weissbier - Non Alcoholic Wheat Beer,0.5%,Erdinger,Beer,107kJ/25kcal,3.6g,14.40,GBP,UK,https://drydrinker.com/products/erdinger-alcohol-free-alkoholfrei-german-wheat-beer-free-glass,http://drydrinker.com/cdn/shop/files/1000px-Erdinger_Alcohol_Free_Alkoholfrei_German_Wheat_Beer_79b39e0c-8dd7-4eae-afaa-9422ea898d63.png?v=1752232592&width=2048,Erdinger Weissbier Alkoholfrei 0.5% ABV. German non alcoholic wheat beer with banana and clove notes.,,,,,drydrinker,https://drydrinker.com,seller
