id,name,abv,producer,product_category,energy,sugar,price,currency,country,url,images,description,gluten_free,vegan,duplicateWith,percentDuplication,site_name,site_url,seller1
1,Bag-in-Box® Merlot - Non-alcoholic beverage - 3L,0%,Pierre Zéro,Other,,4.1g,18,EUR,France,https://shop.pierre-chavin.com/en/pierre-chavin/124-bag-in-box-merlot-non-alcoholic-beverage-3l.html,https://shop.pierre-chavin.com/2163-large_default/bag-in-box-merlot-non-alcoholic-beverage-3l.jpg,"Pierre Zéro Rouge is a fermented then dealcoholized drink made from Merlot. It reveals fragrant aromas of pleasant freshness and sweetness on the palate. To complete an already rich range, Pierre Zéro is available in a 3-liter Bag-in-Box®, ... ... the very first in the alcohol-free world! (non-contractual visual)",,,,,pierre-chavin,https://shop.pierre-chavin.com,seller
2,CHAVIN ZERO Cabernet & Merlot - Dealcoholized Wine - 750ml,0%,Chavin Zéro,Wine,,3g,14,EUR,France,https://shop.pierre-chavin.com/en/pierre-chavin/419-chavin-zero-cabernet-merlot-dealcoholized-wine-750ml.html,https://shop.pierre-chavin.com/2628-large_default/chavin-zero-cabernet-merlot-dealcoholized-wine-750ml.jpg,"Chavin Zéro launches its first range of de-alcoholized Vin De France, merging innovation and French winemaking tradition. Treat yourself to a unique experience if you're looking to savor wine without the effects of alcohol, while preserving the complex nuances and authentic aromas of a selection of French grape varieties. With low-calorie options and no added flavors, Chavin Zéro revolutionizes wine tasting, making moderation and sensory experience possible.",,,,,pierre-chavin,https://shop.pierre-chavin.com,seller
3,Bag-in-Box® Chardonnay - Non-alcoholic Beverage - 3L,0%,Pierre Zéro,Other,,4.5 grams,18,EUR,France,https://shop.pierre-chavin.com/en/pierre-chavin/125-bag-in-box-chardonnay-non-alcoholic-beverage-3l.html,https://shop.pierre-chavin.com/2162-large_default/bag-in-box-chardonnay-non-alcoholic-beverage-3l.jpg,"Pierre Zéro Blanc is a fermented and then dealcoholized drink made from Chardonnay. It reveals intense fruity and floral aromas. To complete an already rich range, Pierre Zéro is available in a 3-liter Bag-in-Box®, ... ... the very first in the alcohol-free universe!",,,,,pierre-chavin,https://shop.pierre-chavin.com,seller
4,CHAVIN ZERO Sauvignon Blanc - Non-Alcoholic French Wine - 750ml,0%,Chavin Zéro,Wine,,2.5g,14,EUR,France,https://shop.pierre-chavin.com/en/pierre-chavin/421-chavin-zero-sauvignon-blanc-non-alcoholic-french-wine-750ml.html,https://shop.pierre-chavin.com/2639-large_default/chavin-zero-sauvignon-blanc-non-alcoholic-french-wine-750ml.jpg,"Chavin Zéro launches its first range in de-alcoholized Vin De France, merging innovation and French wine tradition. Treat yourself to a unique experience if you are looking to savor wine without the effects of alcohol, while preserving the complex nuances and authentic aromas of a selection of French grape varieties. With low-calorie options and no added flavors, Chavin Zéro revolutionizes wine tasting, making moderation and sensory experience possible.",,,,,pierre-chavin,https://shop.pierre-chavin.com,seller
5,Bag-in-Box® Rose - Non-alcoholic beverage - 3L,0%,Pierre Zéro,Other,,4.5 grams,18,EUR,France,https://shop.pierre-chavin.com/en/pierre-chavin/126-bag-in-box-rose-non-alcoholic-beverage-3l.html,https://shop.pierre-chavin.com/2085-large_default/bag-in-box-rose-non-alcoholic-beverage-3l.jpg,"Pierre Zéro Rose is a fermented drink whose freshness, suppleness, and vividness captivate thanks to its intense aromas of fresh red fruits. To complement an already rich range, Pierre Zéro is available in a 3-liter Bag-in-Box®, ... ... the very first in the alcohol-free universe!",,,Bag-in-Box® Merlot - Non-alcoholic beverage - 3L,82.25,pierre-chavin,https://shop.pierre-chavin.com,seller
6,CHAVIN ZERO Rosé - De-alcoholized French Wine - 750ml,0%,Chavin Zéro,Wine,,2.5g,14,EUR,France,https://shop.pierre-chavin.com/en/pierre-chavin/422-chavin-zero-rose-de-alcoholized-french-wine-750ml.html,https://shop.pierre-chavin.com/2684-large_default/chavin-zero-rose-de-alcoholized-french-wine-750ml.jpg,"Chavin Zéro launches its first range in de-alcoholized Vin De France, merging innovation and French wine tradition. Treat yourself to a unique experience if you are looking to savor wine without the effects of alcohol, while preserving the complex nuances and authentic aromas of a selection of French grape varieties. With low-calorie options and no added flavors, Chavin Zéro revolutionizes wine tasting, making moderation and sensory experience possible.",,,,,pierre-chavin,https://shop.pierre-chavin.com,seller
7,PIERRE ZERO Merlot - Non-alcoholic beverage - 750ml,0%,Pierre Zéro,Wine,,4.1g,7.6,EUR,France,https://shop.pierre-chavin.com/en/pierre-chavin/45-pierre-zero-merlot-non-alcoholic-beverage-750ml.html,https://shop.pierre-chavin.com/2133-large_default/pierre-zero-merlot-non-alcoholic-beverage-750ml.jpg,"Discover a complete and elegant alcohol-free range, Pierre Zéro. The dealcoholized wines Pierre Zéro allow those who do not consume alcohol to regain the notion of conviviality around a glass. Pierre Zéro Merlot captivates with its lightness combined with its aromatic power.",,,,,pierre-chavin,https://shop.pierre-chavin.com,seller
8,CHAVIN ZERO Syrah - Non-alcoholic beverage - 75cl,,Chavin Zéro,Wine,,4g,12,EUR,France,https://shop.pierre-chavin.com/en/pierre-chavin/398-chavin-zero-syrah-non-alcoholic-beverage-75cl.html,https://shop.pierre-chavin.com/2423-large_default/chavin-zero-syrah-non-alcoholic-beverage-75cl.jpg,"Discover Chavin Zéro, our new low-calorie alcohol-free wine that is perfect for those who want to indulge in a glass without worrying about the negative effects of alcohol on health. This dealcoholized Syrah wine is made from high-quality grapes and is rich in flavors, making it the ideal choice for wine enthusiasts who wish to enjoy a healthy and sophisticated beverage. The Pierre Chavin Zéro range offers a shelf life of 3 years, making it the perfect choice for those who want to stock up on their favorite drink. Whether you want to enjoy a glass at dinner or share a bottle with friends, Chavin Zéro will always be a delicious and healthy choice.",,,,,pierre-chavin,https://shop.pierre-chavin.com,seller
9,PIERRE ZERO Chardonnay - Non-alcoholic beverage - 750ml,0%,Pierre Zéro,Wine,,4.5 grams,7.6,EUR,France,https://shop.pierre-chavin.com/en/pierre-chavin/10-pierre-zero-chardonnay-non-alcoholic-beverage-750ml.html,https://shop.pierre-chavin.com/2124-large_default/pierre-zero-chardonnay-non-alcoholic-beverage-750ml.jpg,"Discover a complete and elegant alcohol-free range, Pierre Zéro. The de-alcoholized wines Pierre Zéro allow those who do not consume alcohol to rediscover the notion of conviviality around a glass.Pierre Zéro Chardonnay appeals with its very aromatic, fruity, and floral profile. (visual non-contractual)",,,,,pierre-chavin,https://shop.pierre-chavin.com,seller
10,PIERRE ZERO Rose - Non-Alcoholic Beverage - 750ml,0%,Pierre Zéro,Wine,,4.5 grams,7.6,EUR,France,https://shop.pierre-chavin.com/en/pierre-chavin/11-pierre-zero-rose-non-alcoholic-beverage-750ml.html,https://shop.pierre-chavin.com/2685-large_default/pierre-zero-rose-non-alcoholic-beverage-750ml.jpg,"Discover a complete and elegant alcohol-free range, Pierre Zéro. The de-alcoholized wines Pierre Zéro allow those who do not consume alcohol to rediscover the notion of conviviality around a glass.Pierre 0% Rosé delights the palate and extends the sunny days.",,,PIERRE ZERO Merlot - Non-alcoholic beverage - 750ml,82.85714285714286,pierre-chavin,https://shop.pierre-chavin.com,seller
11,PIERRE ZERO Sparkling Rosé - Non-alcoholic Beverage - 750ml,0%,Pierre Zéro,Wine,,4.5 grams,10.5,EUR,France,https://shop.pierre-chavin.com/en/pierre-chavin/14-pierre-zero-sparkling-rose-non-alcoholic-beverage-750ml.html,https://shop.pierre-chavin.com/2682-large_default/pierre-zero-sparkling-rose-non-alcoholic-beverage-750ml.jpg,"Discover a complete and elegant alcohol-free range, Pierre Zéro. The de-alcoholized wines Pierre Zéro allow those who do not consume alcohol to rediscover the concept of conviviality around a glass. The sparkling Pierre Zéro Rosé will accompany your festive moments. (image not contractual)",,,PIERRE ZERO Rose - Non-Alcoholic Beverage - 750ml,80.989010989011,pierre-chavin,https://shop.pierre-chavin.com,seller
12,THE LITTLE STAR Organic Rosé - Non-alcoholic Beverage - 750ml,0%,Le Petit Étoilé,Other,,4.8g,7.6,EUR,France,https://shop.pierre-chavin.com/en/alcohol-free-wine-collection/227-the-little-star-organic-rose-non-alcoholic-beverage-750ml.html,https://shop.pierre-chavin.com/2686-large_default/the-little-star-organic-rose-non-alcoholic-beverage-750ml.jpg,"Le Petit Étoilé is a range of non-alcoholic beverages, free of sulfites, originating from organic farming. Elegant and advocating ""Made In France"", it offers a unique tasting experience! Guaranteed to be 0% alcohol content, this range offers beverages with certified organic and vegan-friendly oenological qualities.",,Vegan,,,pierre-chavin,https://shop.pierre-chavin.com,seller
13,PIERRE ZERO Chardonnay Sparkling - Non-alcoholic Beverage - 750ml,0%,Pierre Zéro,Wine,,4.5 grams,10.5,EUR,France,https://shop.pierre-chavin.com/en/pierre-chavin/13-pierre-zero-chardonnay-sparkling-non-alcoholic-beverage-750ml.html,https://shop.pierre-chavin.com/2126-large_default/pierre-zero-chardonnay-sparkling-non-alcoholic-beverage-750ml.jpg,"Discover a complete and elegant alcohol-free range, Pierre Zéro. The de-alcoholized wines Pierre Zéro allow those who do not consume alcohol to rediscover the notion of conviviality around a glass.Pierre Zéro Chardonnay Effervescent charms with its very aromatic, fruity, and floral profile.",,,PIERRE ZERO Chardonnay - Non-alcoholic beverage - 750ml,85.92233009708738,pierre-chavin,https://shop.pierre-chavin.com,seller
14,OPIA Organic Rose - Non-alcoholic Beverage - 750ml,0%,Ôpia,Other,,4.8g,7.6,EUR,France,https://shop.pierre-chavin.com/en/alcohol-free-wine-collection/151-opia-organic-rose-non-alcoholic-beverage-750ml.html,https://shop.pierre-chavin.com/2687-large_default/opia-organic-rose-non-alcoholic-beverage-750ml.jpg,"Ôpia is the first range of non-alcoholic, non-fermented drinks, originating from organic farming. Elegant and promoting ""Made In France"", it offers a unique tasting experience! Guaranteed to have 0% alcohol content, this range offers beverages with oenological qualities certified halal and vegan friendly.",,Vegan,,,pierre-chavin,https://shop.pierre-chavin.com,seller
15,PIERRE ZERO Spritz - Non-alcoholic drink - 75cl,0.5%,Pierre Zéro,Aperitif,,7.5g,10.5,EUR,France,https://shop.pierre-chavin.com/en/pierre-chavin/400-pierre-zero-spritz-non-alcoholic-drink-75cl.html,https://shop.pierre-chavin.com/2619-large_default/pierre-zero-spritz-non-alcoholic-drink-75cl.jpg,"If you are looking for a non-alcoholic alternative for a party or event, or simply a refreshing drink for a hot day, the Pierre Zéro Spritz is the ideal option. With less than 0.5% alcohol, you can enjoy this delicious Spritz without having to worry about the effects of alcohol. Spritz is a drink ideally enjoyed as an aperitif.",,,,,pierre-chavin,https://shop.pierre-chavin.com,seller
16,OPIA Organic Cabernet Sauvignon - Non-Alcoholic Beverage - 750ml,0%,Ôpia,Other,,4.8g,7.6,EUR,France,https://shop.pierre-chavin.com/en/pierre-chavin/152-opia-organic-cabernet-sauvignon-non-alcoholic-beverage-750ml.html,https://shop.pierre-chavin.com/2466-large_default/opia-organic-cabernet-sauvignon-non-alcoholic-beverage-750ml.jpg,"Ôpia is the first range of non-alcoholic, non-fermented drinks, derived from organic farming. Elegant and advocating ""Made In France"", it offers a unique tasting experience! Guaranteed 0% alcohol content, this range offers drinks with oenological qualities certified halal and vegan friendly.",,Vegan,,,pierre-chavin,https://shop.pierre-chavin.com,seller
17,Non-Alcoholic Spritz Pack – Pierre Zéro Summer Duo,,Pierre Zéro,Aperitif,,,20,EUR,France,https://shop.pierre-chavin.com/en/pierre-chavin/453-pack-pierre-zero-spritz-lemon-spritz-non-alcoholic-cocktails.html,https://shop.pierre-chavin.com/2659-large_default/pack-pierre-zero-spritz-lemon-spritz-non-alcoholic-cocktails.jpg,"The ultimate summer duo: freshness &amp; elegance, alcohol-free. Discover our exclusive Pierre Zéro pack, combining two sparkling and refined cocktails: 🍊 Classic Spritz, our summer 2024 bestseller 🍋 Lemon Spritz, the fresh, citrusy new arrival Perfect for sunny aperitifs — enjoy without moderation.",,,,,pierre-chavin,https://shop.pierre-chavin.com,seller
18,"Pierre Chavin - Pierre Zéro, the first alcohol-free red aged in oak barrels",0%,Pierre Zéro,Wine,,4.6g,12.5,EUR,France,https://shop.pierre-chavin.com/en/pierre-chavin/82-pierre-zero-prestige-merlot-non-alcoholic-beverage-750ml.html,https://shop.pierre-chavin.com/2135-large_default/pierre-zero-prestige-merlot-non-alcoholic-beverage-750ml.jpg,Absolutely must try... A great red wine without alcohol crafted with the utmost care to achieve a high level of excellence. Pierre Zéro Prestige Merlot benefits from barrel aging and brings a new premium dimension to the famous Zéro line by Pierre Chavin.,,,,,pierre-chavin,https://shop.pierre-chavin.com,seller
19,LE PETIT ETOILE Cabernet Sauvignon - Non-alcoholic beverage - 750ml,0%,Le Petit Étoilé,Other,,4.8g,7.6,EUR,France,https://shop.pierre-chavin.com/en/alcohol-free-wine-collection/226-le-petit-etoile-cabernet-sauvignon-non-alcoholic-beverage-750ml.html,https://shop.pierre-chavin.com/2099-large_default/le-petit-etoile-cabernet-sauvignon-non-alcoholic-beverage-750ml.jpg,"Le Petit Étoilé is a range of non-alcoholic beverages, free of sulfites, originating from organic farming. Elegant and advocating ""Made In France"", it offers a unique tasting experience! Guaranteed to be 0% alcohol content, this range offers beverages with certified organic and vegan-friendly oenological qualities.",,Vegan,,,pierre-chavin,https://shop.pierre-chavin.com,seller
20,SILHOUET Merlot - Non-alcoholic drink - Low Calorie - 750ml,0%,Silhouet,Wine,,"It appears you entered ""0g,"" which does not provide sufficient context for translation. Could you please provide a longer text or more details so I can assist you better?",6.6,EUR,France,https://shop.pierre-chavin.com/en/pierre-chavin/132-silhouet-merlot-non-alcoholic-drink-low-calorie-750ml.html,https://shop.pierre-chavin.com/2286-large_default/silhouet-merlot-non-alcoholic-drink-low-calorie-750ml.jpg,"Silhouet' is a range of ""low calorie"" alcohol-free wines that embodies femininity and lightness. Made from natural aromas, Silhouet' is intended for all those who wish to stay in shape.",,,,,pierre-chavin,https://shop.pierre-chavin.com,seller
21,PIERRE ZERO Spritz XS - Non-alcoholic beverage - 20cl,0.5%,Pierre Zéro,Aperitif,,7.5g,3.7,EUR,France,https://shop.pierre-chavin.com/en/pierre-chavin/413-pierre-zero-spritz-xs-non-alcoholic-beverage-20cl.html,https://shop.pierre-chavin.com/2501-large_default/pierre-zero-spritz-xs-non-alcoholic-beverage-20cl.jpg,"If you are looking for a non-alcoholic alternative for a party or event, or simply a refreshing drink for a hot day, the Pierre Zéro Spritz is the ideal option. With less than 0.5% alcohol, you can enjoy this delicious Spritz without having to worry about the effects of alcohol. Spritz is a drink ideally enjoyed as an aperitif.",,,,,pierre-chavin,https://shop.pierre-chavin.com,seller
22,PIERRE ZERO Chardonnay Sparkling XS - Non-alcoholic Beverage - 200ml,0%,Pierre Zéro,Wine,,4.5 grams,3.7,EUR,France,https://shop.pierre-chavin.com/en/pierre-chavin/99-pierre-zero-chardonnay-sparkling-xs-non-alcoholic-beverage-200ml.html,https://shop.pierre-chavin.com/2137-large_default/pierre-zero-chardonnay-sparkling-xs-non-alcoholic-beverage-200ml.jpg,"Discover a complete and elegant alcohol-free range, Pierre Zéro. The dealcoholized wines Pierre Zéro allow those who do not consume alcohol to rediscover the notion of conviviality around a glass. Discover Pierre Zéro Effervescent Chardonnay Blanc in its 20cl format. (non-contractual visual)",,,PIERRE ZERO Chardonnay Sparkling - Non-alcoholic Beverage - 750ml,87.54385964912281,pierre-chavin,https://shop.pierre-chavin.com,seller
23,SILHOUET Chardonnay - Non-alcoholic Beverage - Low Calorie - 750ml,0%,Silhouet,Wine,,"It appears you entered ""0g,"" which does not provide sufficient context for translation. Could you please provide a longer text or more details so I can assist you better?",6.6,EUR,France,https://shop.pierre-chavin.com/en/pierre-chavin/131-silhouet-chardonnay-non-alcoholic-beverage-low-calorie-750ml.html,https://shop.pierre-chavin.com/2088-large_default/silhouet-chardonnay-non-alcoholic-beverage-low-calorie-750ml.jpg,"Silhouet' is a range of ""low calorie"" dealcoholized wines that embodies femininity and lightness. Made with natural aromas, Silhouet' is intended for all those who wish to stay in shape.",,,,,pierre-chavin,https://shop.pierre-chavin.com,seller
24,PIERRE ZERO Sparkling Rose XS - Non-alcoholic Beverage - 200ml,0%,Pierre Zéro,Wine,,4.5 grams,3.7,EUR,France,https://shop.pierre-chavin.com/en/pierre-chavin/100-pierre-zero-sparkling-rose-xs-non-alcoholic-beverage-200ml.html,https://shop.pierre-chavin.com/2138-large_default/pierre-zero-sparkling-rose-xs-non-alcoholic-beverage-200ml.jpg,"Discover a complete and elegant alcohol-free range, Pierre Zéro. The de-alcoholized wines Pierre Zéro allow those who do not consume alcohol to rediscover the notion of conviviality around a glass. Discover Pierre Zéro Effervescent Rose in its 20cl format. (visual non-contractual)",,,PIERRE ZERO Sparkling Rosé - Non-alcoholic Beverage - 750ml,85.00000000000001,pierre-chavin,https://shop.pierre-chavin.com,seller
25,OPIA Organic Chardonnay - Non-alcoholic Beverage - 750ml,0%,Ôpia,Other,,4.8g,7.6,EUR,France,https://shop.pierre-chavin.com/en/alcohol-free-wine-collection/150-opia-organic-chardonnay-non-alcoholic-beverage-750ml.html,https://shop.pierre-chavin.com/2288-large_default/opia-organic-chardonnay-non-alcoholic-beverage-750ml.jpg,"Ôpia is the first range of non-alcoholic, non-fermented drinks derived from organic farming. Elegant and promoting ""Made In France"", it offers a unique tasting experience! Guaranteed 0% alcohol content, this range offers drinks with halal certified oenological qualities and vegan friendly.",,Vegan,,,pierre-chavin,https://shop.pierre-chavin.com,seller
26,LE PETIT ETOILE Organic Chardonnay - Non-Alcoholic Beverage - 750ml,0%,Le Petit Étoilé,Other,,4.8g,7.6,EUR,France,https://shop.pierre-chavin.com/en/alcohol-free-wine-collection/225-le-petit-etoile-organic-chardonnay-non-alcoholic-beverage-750ml.html,https://shop.pierre-chavin.com/2098-large_default/le-petit-etoile-organic-chardonnay-non-alcoholic-beverage-750ml.jpg,"Le Petit Étoilé is a range of non-alcoholic beverages, free from sulfites, derived from organic farming. Elegant and advocating ""Made In France"", it offers a unique tasting experience! Guaranteed 0% alcohol content, this range offers beverages with certified organic oenological qualities and is vegan friendly.",,Vegan,,,pierre-chavin,https://shop.pierre-chavin.com,seller
27,PIERRE ZERO SIGNATURE - red - Non-alcoholic beverage - 750ml,0%,Pierre Zéro,Wine,,4g,15,EUR,France,https://shop.pierre-chavin.com/en/pierre-chavin/379-pierre-zero-signature-red-non-alcoholic-beverage-750ml.html,https://shop.pierre-chavin.com/2233-large_default/pierre-zero-signature-red-non-alcoholic-beverage-750ml.jpg,Discover the Pierre Zéro Signature which perfectly completes the Pierre Zéro range. The alcohol-free wines Pierre Zéro allow those who do not consume alcohol to rediscover the notion of conviviality around a glass.Pierre Zéro Signature impresses with its very aromatic and fruity profile. (non-contractual visual),,,PIERRE ZERO Rose - Non-Alcoholic Beverage - 750ml,80.989010989011,pierre-chavin,https://shop.pierre-chavin.com,seller
28,PIERRE ZERO SIGNATURE - white - Non-alcoholic beverage - 750ml,0%,Pierre Zéro,Wine,,4g,15,EUR,France,https://shop.pierre-chavin.com/en/pierre-chavin/376-pierre-zero-signature-white-non-alcoholic-beverage-750ml.html,https://shop.pierre-chavin.com/2235-large_default/pierre-zero-signature-white-non-alcoholic-beverage-750ml.jpg,Discover the Pierre Zéro Signature which perfectly completes the Pierre Zéro range. The alcohol-free wines Pierre Zéro allow those who do not consume alcohol to rediscover the notion of conviviality around a glass.Pierre Zéro Signature impresses with its very aromatic and fruity profile. (non-contractual visual),,,PIERRE ZERO SIGNATURE - red - Non-alcoholic beverage - 750ml,86.66666666666667,pierre-chavin,https://shop.pierre-chavin.com,seller
29,PIERRE ZERO SIGNATURE - sparkling white - Non-alcoholic beverage - 750ml,0%,Pierre Zéro,Wine,,2g,20,EUR,France,https://shop.pierre-chavin.com/en/pierre-chavin/364-pierre-zero-signature-sparkling-white-non-alcoholic-beverage-750ml.html,https://shop.pierre-chavin.com/2616-large_default/pierre-zero-signature-sparkling-white-non-alcoholic-beverage-750ml.jpg,Discover the Pierre Zéro Signature that perfectly complements the Pierre Zéro range. The de-alcoholized wines Pierre Zéro allow those who do not consume alcohol to rediscover the notion of conviviality around a glass.Pierre Zéro Signature Effervescent captivates with its very aromatic and fruity profile. (visual non-contractual),,,PIERRE ZERO SIGNATURE - white - Non-alcoholic beverage - 750ml,86.72566371681415,pierre-chavin,https://shop.pierre-chavin.com,seller
30,PIERRE ZERO SIGNATURE - sparkling rosé - Non-alcoholic beverage - 750ml,0%,Pierre Zéro,Wine,,"""5g""",20,EUR,France,https://shop.pierre-chavin.com/en/pierre-chavin/377-pierre-zero-signature-sparkling-rose-non-alcoholic-beverage-750ml.html,https://shop.pierre-chavin.com/2688-large_default/pierre-zero-signature-sparkling-rose-non-alcoholic-beverage-750ml.jpg,Discover the Pierre Zéro Signature that perfectly complements the Pierre Zéro range. The de-alcoholized wines Pierre Zéro allow those who do not consume alcohol to rediscover the notion of conviviality around a glass.Pierre Zéro Signature Effervescent captivates with its very aromatic and fruity profile. (visual non-contractual),,,PIERRE ZERO Sparkling Rosé - Non-alcoholic Beverage - 750ml,87.27272727272728,pierre-chavin,https://shop.pierre-chavin.com,seller
31,LE PETIT ETOILE Sparkling Chardonnay Organic - Non-alcoholic Beverage - 750ml,0%,Le Petit Étoilé,Other,,4.8g,10.6,EUR,France,https://shop.pierre-chavin.com/en/pierre-chavin/228-le-petit-etoile-sparkling-chardonnay-organic-non-alcoholic-beverage-750ml.html,https://shop.pierre-chavin.com/2236-large_default/le-petit-etoile-sparkling-chardonnay-organic-non-alcoholic-beverage-750ml.jpg,"Le Petit Étoilé is a range of non-alcoholic beverages, free of sulfites, originating from organic farming. Elegant and advocating ""Made In France"", it offers a unique tasting experience! Guaranteed to be 0% alcohol content, this range offers beverages with certified organic and vegan-friendly oenological qualities.",,Vegan,LE PETIT ETOILE Organic Chardonnay - Non-Alcoholic Beverage - 750ml,84.63414634146343,pierre-chavin,https://shop.pierre-chavin.com,seller
32,SILHOUET Chardonnay Sparkling - Non-alcoholic Beverage - Low Calorie - 750ml,0%,Silhouet,Wine,,"It appears you entered ""0g,"" which does not provide sufficient context for translation. Could you please provide a longer text or more details so I can assist you better?",9.6,EUR,France,https://shop.pierre-chavin.com/en/pierre-chavin/133-silhouet-chardonnay-sparkling-non-alcoholic-beverage-low-calorie-750ml.html,https://shop.pierre-chavin.com/2090-large_default/silhouet-chardonnay-sparkling-non-alcoholic-beverage-low-calorie-750ml.jpg,"Silhouet' is a range of ""low calorie"" dealcoholized wines that embodies femininity and lightness. Crafted with natural aromas, Silhouet' is intended for everyone who wants to maintain their figure.",,,SILHOUET Chardonnay - Non-alcoholic Beverage - Low Calorie - 750ml,87.27272727272728,pierre-chavin,https://shop.pierre-chavin.com,seller
33,OPIA Sparkling Organic Chardonnay - Non-alcoholic Beverage - 750ml,0%,Ôpia,Other,,4.8g,10.6,EUR,France,https://shop.pierre-chavin.com/en/alcohol-free-wine-collection/153-opia-sparkling-organic-chardonnay-non-alcoholic-beverage-750ml.html,https://shop.pierre-chavin.com/2117-large_default/opia-sparkling-organic-chardonnay-non-alcoholic-beverage-750ml.jpg,"Ôpia is the first range of non-alcoholic, non-fermented drinks, originating from organic farming. Elegant and promoting ""Made In France"", it offers a unique tasting experience! Guaranteed to have 0% alcohol content, this range offers beverages with oenological qualities certified halal and vegan friendly.",,Vegan,OPIA Organic Chardonnay - Non-alcoholic Beverage - 750ml,86.0952380952381,pierre-chavin,https://shop.pierre-chavin.com,seller
34,FLORENTINA Spritz - Non-alcoholic sparkling drink 750ml,0%,Florentina,Other,,7.5g,8.5,EUR,France,https://shop.pierre-chavin.com/en/pierre-chavin/354-florentina-spritz-non-alcoholic-sparkling-drink-750ml.html,https://shop.pierre-chavin.com/2308-large_default/florentina-spritz-non-alcoholic-sparkling-drink-750ml.jpg,"Florentina 0% spritz, organic effervescent non-alcoholic drink, reveals delicate bubbles that are both fine and persistent. The color is slightly pink with bright reflections. The nose has aromas of bitter orange zest and spices. The tangy yet generous flavor of orange peels in the Florentina Spritz combines with notes of spices and vanilla for a perfect balance between bitterness and sweetness.",,,,,pierre-chavin,https://shop.pierre-chavin.com,seller
