id,name,abv,producer,product_category,energy,sugar,price,currency,country,url,images,description,gluten_free,vegan,duplicateWith,percentDuplication,site_name,site_url,seller1
1,YOURS Non-Alcoholic Wine California Cabernet Sauvignon,,YOURS,Wine,20,2g,25.99,USD,USA,https://sipyours.com/collections/non-alcoholic-wine/products/yours-non-alcoholic-wine-california-cabernet-sauvignon,http://sipyours.com/cdn/shop/files/ProductImages_20_copy.png?v=1741665032&width=1200,"Here's what to expect when you swap your traditional glass of wine for a glass of YOURS: Sleep Better Feel More Focused Have More Energy Get More Done Reduce Your Anxiety Improve Your Mood Improve Your Skin Perhaps Even Shed a Few Pounds How can one wine do all this? It can't. But YOURS isn't a wine. It's a commitment to a new, improved version of yourself. Whether it's temporary (hello, baby!) or permanent, you'll change once you start drinking YOURS. And change is good. While it may feel a little uncomfortable at first, our promise to you is that it will all be worth it. You just have to experience the YOURS difference for yourself. The Wine YOURS is everything you love about Cabernet Sauvignon, without the mornings you hate. There's something special about Cabernet Sauvignon. The color. The aroma. The weight. Nothing quite feels like that first sip, where troubles float away and a smile takes hold. It's quite literally perfection. But for those of us looking to reduce or eliminate alcohol from our lives, the beauty of Cabernet Sauvignon has been ripped away. That is, until now... YOURS Non-Alcoholic California Cabernet Sauvignon combines world-famous California Cabernet Sauvignon Wine with a sommelier-selected blend of natural flavors and ingredients to create the world's most delicious alcohol-free cab. With YOURS Non-Alcoholic Cabernet, you can still have that wine experience you know and love, just without the alcohol. Keep the flavor, ditch the poison. But don't just take our word for it. Here's what real YOURS customers have said about our Cabernet Sauvignon: ""I’ve tried my fair share of nonalcoholic wines and can honestly say this is the best one I’ve ever had. This nonalcoholic Cabernet Sauvignon has depth of flavor- something that most nonalcoholic wines lack."" - Roshani ""I have sampled numerous nonalcoholic Cabernets. YOURS is one of the best."" -Patricia The Details Size 750mL Serving Size 5oz Calories per Serving 20 Carbohydrates per Serving 4g Total Sugars per Serving 2g (no added sugar) Ingredients Dealcoholized Wine, Filtered Water, Grape Juice Concentrate, Propylene Glycol, Gum Arabic, Natural Flavors, Potassium Carbonate, Sulfites (preservative)",,,,,sipyours,https://sipyours.com,seller
2,YOURS Non-Alcoholic Wine Washington Sauvignon Blanc,,YOURS,Wine,17,1g,25.99,USD,USA,https://sipyours.com/collections/non-alcoholic-wine/products/yours-non-alcoholic-wine-washington-sauvignon-blanc,http://sipyours.com/cdn/shop/files/Product_Images-removebg.png?v=1758733541&width=1200,"YOURS is everything you love about a fruity refreshing Sauvignon Blanc, without the compromise of alcohol. This crisp Sauvignon Blanc opens with aromas of citrus and tropical fruits. The bright flavors of lime and grapefruit on the palette lead to a crisp, juicy finish. All the joy of a Sauvignon Blanc flavor without the alcohol. When we set out to make a non-alcoholic Sauvignon Blanc, we had no idea how big a challenge we took on. But thankfully we weren’t alone. We partnered with some of Washington’s best winemakers, who helped us recreate the flavors and experience that make this wine so special. It took longer than expected (we knew we had to get it just right), but the result is non-alcoholic Sauvignon Blanc that truly lives up to its reputation. For those that know Sauvignon Blanc well, you’ll be amazed at how closely this resembles the original. The Details Size 750mL Serving Size 3.4oz Calories per Serving 17 Carbohydrates per Serving 2g Total Sugars per Serving 1g (no added sugar) Ingredients Alcohol Removed Wine, Grape Juice Concentrate, Potassium carbonate, Oak tanin, CMC (Carboxymethylcellulose, stabilizer).",,,,,sipyours,https://sipyours.com,seller
3,YOURS Non-Alcoholic Wine California Chardonnay,,YOURS,Wine,30,4g,24.99,USD,USA,https://sipyours.com/collections/non-alcoholic-wine/products/yours-non-alcoholic-wine-award-winning-california-chardonnay,http://sipyours.com/cdn/shop/files/yours-non-alcoholic-chardonnay_6da457f6-5fab-40a0-bc33-6a8f60520c04.png?v=1702660168&width=1200,"YOURS is everything you love about oaky California Chardonnay, without the compromise of alcohol. California Chardonnay has quite the reputation. The color. The aroma. The flavor. It’s all iconic (and delicious). Which is why it’s no surprise that this varietal is one of the best-selling wines in the world. When we set out to make a non-alcoholic chardonnay that could live up to such a reputation, we had no idea how big a challenge we took on. But thankfully we weren’t alone. We partnered with some of California’s most awarded and celebrated Chardonnay experts, who helped us recreate the flavors and experience that make this wine so special. It took longer than expected (we knew we had to get it just right), but the result is non-alcoholic chardonnay that truly lives up to its reputation. For those that know chardonnay well, you’ll be amazed at how closely this resembles the original. The Details Size 750mL Serving Size 5oz Calories per Serving 30 Carbohydrates per Serving 7g Total Sugars per Serving 4g (no added sugar) Ingredients Dealcoholized Chardonnay Wine, Filtered Water, Grape Juice Concentrate, Propylene Glycol, Gum Arabic, Natural Flavors, Potassium Carbonate, Sulfites (preservative)",,,,,sipyours,https://sipyours.com,seller
4,YOURS Non-Alcoholic Sampler Pack (4 Wines),,YOURS,Wine,,,89.99,USD,USA,https://sipyours.com/collections/non-alcoholic-wine/products/yours-non-alcoholic-wine-sampler-pack-4-wines-1,http://sipyours.com/cdn/shop/files/Sampler_Pack_2_a9cc2ce6-98ac-4a05-8f5a-b2274e09580c.png?v=1758733624&width=1200,"Here's what to expect when you swap your traditional glass of wine for a glass of YOURS: Sleep Better Feel More Focused Have More Energy Get More Done Reduce Your Anxiety Improve Your Mood Improve Your Skin Perhaps Even Shed a Few Pounds How can one wine do all this? It can't. But YOURS isn't a wine. It's a commitment to a new, improved version of yourself. Whether it's temporary (hello, baby!) or permanent, you'll change once you start drinking YOURS. And change is good. While it may feel a little uncomfortable at first, our promise to you is that it will all be worth it. You just have to experience the YOURS difference for yourself. The Wine Interested in YOURS but not quite sure where to start? Well, why not try them all? The YOURS Non-Alcoholic Wine Sampler Pack includes everything you need to start exploring the incredible world of non-alcoholic wines. Each kit includes the following: One Bottle of YOURS Non-Alcoholic Cabernet Sauvignon One Bottle of YOURS Non-Alcoholic Award-Winning California Red Blend One Bottle of YOURS Non-Alcoholic Washington Sauvignon Blanc One Bottle of YOURS Non-Alcoholic California Chardonnay YOURS Non-Alcoholic Cabernet Sauvignon There's something special about Cabernet Sauvignon. The color. The aroma. The weight. Nothing quite feels like that first sip, where troubles float away and a smile takes hold. It's quite literally perfection. But for those of us looking to reduce or eliminate alcohol from our lives, the beauty of Cabernet Sauvignon has been ripped away. That is, until now... YOURS Non-Alcoholic California Cabernet Sauvignon combines world-famous California Cabernet Sauvignon Wine with a sommelier-selected blend of natural flavors and ingredients to create the world's most delicious alcohol-free cab. On the tongue, this alcohol-free cabernet boasts a complex yet approachable blend of flavors, including: Black Cherry Blackberry Black Currant Anise Green Bell Pepper Oak Fresh Ground Peppercorns YOURS Cabernet Sauvignon is rich, dry, and free from the lingering sweetness that dominates most NA wines on the market. YOURS Non-Alcoholic Wine Award-Winning California Red Blend YOURS Non-Alcoholic California Red Blend combines real dealcoholized California red wine with a carefully crafted blend of flavors, offering that rich red wine experience you love, but without the alcohol. Pouring a velvety shade of violet and carrying the aromas of spice and fresh vanilla, from the second YOURS Non-Alcoholic California Red Blend leaves the bottle, it’s clear you’re about to enjoy something special. As you sip, you’ll experience a bright bouquet of flavors, including: Vanilla Blackberry Chocolate Oak Fresh Ground Peppercorns Unlike most non-alcoholic wines, there’s no lingering sweetness with YOURS. Instead, you’ll enjoy a rich, complex red wine that finishes with that signature “bite” you know and love. And it’s this bite we’ve worked so hard to create, and what makes YOURS so special. YOURS Limited Release Seasonal Rosé Another limited release non-alcoholic wine crafted by some of California's finest winemakers, YOURS Non-Alcoholic Wine Small Batch Seasonal Rosé shines bright with fresh fruit flavors and aromas. Pouring the perfect shade of pink, this refreshingly different rosé is packed with the perfect blend of flavors, including Strawberry Citrus Melon Raspberry Cherry Fresh Floral Notes Best served chilled, this alcohol-free rosé is light on the tongue, yet still alive with flavor. YOURS Non-Alcoholic California Chardonnay California Chardonnay has a big reputation. So for this non-alcoholic wine, we worked with some of the finest winemakers and sommeliers in California to ensure we nailed the flavor and experience. YOURS Non-Alcoholic Chardonnay pours golden hue that glimmers in the glass, immediately captivating the senses. Upon the first sip, the wine reveals a harmonious balance of flavors and textures. Crisp, green apple and citrus notes dance on the palate, while subtle hints of vanilla and oak provide a creamy, luxurious mouthfeel. The wine's exceptional craftsmanship is evident in its well-integrated acidity, offering a refreshing and lively character. Its long, elegant finish leaves a lingering impression, making it a quintessential choice for those seeking a superb Chardonnay that embodies the essence of California's winemaking prowess. Each sip of this alcohol free chardonnay boasts a complex yet approachable blend of flavors, including: Buttery, Crisp Apple Fresh Pear Citrus Vanilla Oak Tropical Fruits Most importantly, YOURS Non-Alcoholic Chardonnay is free from the lingering sweetness that dominates most NA wines on the market. The Experience While we’re certain you’ll love the taste, YOURS is about more than just the flavor. It’s about the experience. That proverbial weight lifted off your shoulders as you take that first sip of wine after a long day. And with YOURS, it’s the same experience of relaxation and release that wine always brings, just without the guilt. While we can never replace the missing alcohol (nor would we want to), we promise that YOURS is unlike any non-alcoholic wine you've ever experienced. Whether you’re toasting the bride and groom, or just toasting yourself as you curl up on the couch for another episode, YOURS is perfect for any occasion. If you’re looking for wine without compromise, the choice is YOURS.",,,,,sipyours,https://sipyours.com,seller
5,YOURS Non-Alcoholic Wine Award-Winning California Red Blend,,YOURS,Wine,10,1g,23.99,USD,USA,https://sipyours.com/collections/non-alcoholic-wine/products/yours-non-alcoholic-california-red-blend,http://sipyours.com/cdn/shop/files/yours-non-alcoholic-california-red-blend-main-award-image-2.png?v=1684928894&width=1200,"The Only Wine You’ll Feel Good Drinking. YOURS Non-Alcoholic California Red Blend combines real dealcoholized California red wine with a carefully crafted blend of flavors, offering that rich red wine experience you love, but without the alcohol.The result? A wine you feel great about drinking, and an experience you'll never forget. The Details Size 750mL Serving Size 5oz Calories per Serving 10 Carbohydrates per Serving 2g Total Sugars per Serving 1g (none added) Ingredients Dealcoholized Red Wine, Water, Grape Juice Concentrate, Natural Flavors, Gum Arabic, Potassium Carbonate, Monk Fruit Extract, Sulfites (preservative)",,,,,sipyours,https://sipyours.com,seller
