id,name,abv,producer,product_category,energy,sugar,price,currency,country,url,images,description,gluten_free,vegan,duplicateWith,percentDuplication,site_name,site_url,seller1
1,Non-Alcoholic Sparkling Rosé Can 4-Pack,,Surely,Wine,40 cals,3gg,24.99,USD,USA,https://www.drinksurely.com/products/non-alcoholic-sparkling-rose-can,http://www.drinksurely.com/cdn/shop/files/10_offandfreeshippingwhenyoubuy2_38.png?v=1686873121,"Bursting with delicate fruit flavors of guava, strawberry and kiwi, this refreshing Sparkling Rosé will take you back to your favorite warm weather memories. An easy drinker for a wine newbie or a connoisseur.",Gluten free,,,,drinksurely,https://www.drinksurely.com,seller
2,Non-Alcoholic Brut Can 4-Pack,,Surely,Wine,30 cals,3gg,24.99,USD,USA,https://www.drinksurely.com/products/non-alcoholic-brut-wine-cans,http://www.drinksurely.com/cdn/shop/files/10_offandfreeshippingwhenyoubuy2_34.png?v=1686873360,"A bold but pleasant Brut wine for any time of day. Not too dry, not too sweet. Hints of lemon, peach and custard keep your tastebuds craving more. Best enjoyed at dinner with Ciara and Russell or at home lounging in Chrissy Teigen’s butter robe",Gluten free,,,,drinksurely,https://www.drinksurely.com,seller
3,Non-Alcoholic Bubbly Red Can 4-Pack,,Surely,Wine,35 calories,4gg,24.99,USD,USA,https://www.drinksurely.com/products/non-alcoholic-bubbly-red-cabernet-pinot-noir,http://www.drinksurely.com/cdn/shop/files/10_offandfreeshippingwhenyoubuy2_36.png?v=1685143085,"A full bodied non-alcoholic red wine for any occasion. Our Non-alcoholic Pinot Noir has smooth velvety tannins with lovely notes of cranberry, plum and blackberry. Well rounded in terms of tannins, fruit and acid ratio. The perfect wine for any crowd.",,,,,drinksurely,https://www.drinksurely.com,seller
4,Non-Alcoholic Sauvignon Blanc,0.5% ABV,Surely,Wine,20 cals,2gg,22.99,USD,USA,https://www.drinksurely.com/products/non-alcoholic-sauvignon-blanc-wine,http://www.drinksurely.com/cdn/shop/products/AWARDS_SAUVBLANC.png?v=1669100647,"Surely alcohol-removed Sauvignon Blanc with soft notes of pear, apple and lemon. Crisp, clean and bright. 0.5% ABV white wine.",,,,,drinksurely,https://www.drinksurely.com,seller
5,Non-Alcoholic Sparkling Rosé,,Surely,Other,25 cals,2gg,24.99,USD,USA,https://www.drinksurely.com/products/sparkling-nonalcoholic-rose,http://www.drinksurely.com/cdn/shop/products/AWARDS_SPARKROSE.png?v=1669099467,"Surely alcohol-removed sparkling rosé has crisp, light notes of strawberry, pear, and tropical fruit balanced with a light acid for a full finish.",,,,,drinksurely,https://www.drinksurely.com,seller
6,Non-Alcoholic Sparkling Brut,,Surely,Wine,15 cals,2gg,24.99,USD,USA,https://www.drinksurely.com/products/non-alcoholic-sparkling-white-wine,http://www.drinksurely.com/cdn/shop/files/1_38cb281e-6cf4-4ecd-a819-225d51497820.png?v=1701450526,This sparkling non-alcoholic white wine tastes just like the real thing. Perfect for late night drinks and hangover-free mornings.,,,,,drinksurely,https://www.drinksurely.com,seller
7,Non-Alcoholic Red Blend,,Surely,Other,,5gg,24.99,USD,USA,https://www.drinksurely.com/products/non-alcoholic-red-blend,http://www.drinksurely.com/cdn/shop/files/Surely_RedBlend_Mockup_Front.png?v=1757584001,"A complex, smoky, & layered NA red unlike any other. Dark fruit meets smooth vanilla, rich oak, smoke & spice. Not a varietal. A completely unique sip.",,,,,drinksurely,https://www.drinksurely.com,seller
