id,name,abv,producer,product_category,energy,sugar,price,currency,country,url,images,description,gluten_free,vegan,duplicateWith,percentDuplication,site_name,site_url,seller1
1,Oddbird Domaine de la Prade Merlot Shiraz - Red Wine - Non-Alcoholic - 0%,,Oddbird,Wine,,,14.99,EUR,Ireland,https://diceys.com/onlinestore/shop/product/oddbird-domaine-de-la-prade-merlot-shiraz-organic-red-wine-non-alcoholic-0,https://diceys.com/wp-content/uploads/2023/01/Oddbird_Domaine_de_la_Prade_Merlot_Shiraz_Dicey_Reillys.jpg,"Oddbird Domaine De La Prade Organic is a non-alcoholic red wine. It is made from a blend of Merlot and Shiraz from the Languedoc-Roussillon region of France. Aged for 12 months, this wine has notes of blackberry, cherry, plum and caramel. Oddbird is on a mission to transform society’s drinking culture by creating world-class beverages – liberated from alcohol. Founded by Moa Gürbüzer, a decades-long therapist/social worker, Oddbird has grown into Sweden’s largest producer of quality wines. 700ml/0%Alc",,,,,diceys,https://diceys.com,seller
2,Eisberg Sauvignon Blanc Non Alcoholic,,,Other,,,7.99,EUR,Ireland,https://diceys.com/onlinestore/shop/product/eisberg-sauvignon-blanc-non-alcoholic,https://diceys.com/wp-content/uploads/2021/01/eisberg-sauvignon-blanc-@-diceys-off-licence.jpg,Made from de alcoholised Sauvignon Blanc grapes with classic gooseberry and tropical fruit flavours. 750ml,,,,,diceys,https://diceys.com,seller
3,Heineken 0.0 6x330ml can,,,Beer,,,7.99,EUR,Ireland,https://diceys.com/onlinestore/shop/product/heineken-0-0-6x330ml-can,https://diceys.com/wp-content/uploads/2021/01/heineken-can-non-alcoholic-@-diceys-off-licence.jpg,"Heineken’s unique 0.0 recipe is brewed with pure malt and special A-Yeast, just like the original Heineken lager beer. Heineken 0.0, a natural, pure malt lager for a premium taste, without alcohol. 6x330ml can",,,,,diceys,https://diceys.com,seller
4,Kopparberg Strawberry & Lime Non Alcoholic,,,Cider,,,1.99,EUR,Ireland,https://diceys.com/onlinestore/shop/product/kopparberg-strawberry-lime-non-alcoholic,https://diceys.com/wp-content/uploads/2021/01/kopperberg-strawberry-lime-non-alcoholic-@-diceys-off-licence.jpg,The experienced cider makers at Kopparberg have put their efforts into going alcohol free and have been rewarded with this fantastic strawberry & lime Cider. Raspberry and blackcurrant flavours burst from this cider giving it a rich and indulgent energy. It’s the perfect fruity refreshment for any occasion. 500ml Bottle,,,,,diceys,https://diceys.com,seller
5,Erdinger Alkoholfrei 500ml,0.5%,,Other,,,1.90,EUR,Ireland,https://diceys.com/onlinestore/shop/product/erdinger-non-alcoholic-bottle,https://diceys.com/wp-content/uploads/2021/01/erdinger-bottle-non-alcoholic-@-diceys-off-licence.jpg,"Erdinger Alkoholfrei is brewed under the strict Bavarian Purity Law, which means it is made from only high quality, natural ingredients. The isotonic thirst quencher with the inimitable refreshing taste provides the body with essential nutrients. Folic acid and vitamin B12 reduce fatigue and support the immune system, B12 also promotes energy-yielding metabolism. Just one bottle (0.5l) per day contributes to a healthy nutrition. Erdinger Alkoholfrei contains less than 0.5% vol. alc.",,,,,diceys,https://diceys.com,seller
6,Domaine De La Prade Chardonnay,0.0%,Oddbird,Wine,,,13.99,EUR,Ireland,https://diceys.com/onlinestore/shop/product/domaine-de-la-prade-chardonnay,https://diceys.com/wp-content/uploads/2023/12/Domaine_De_La_Prade_Chardonnay_Dicey_Off_Licence.jpg,"A crispy 100% Chardonnay wine from the Languedoc-Roussillon region of France. The Domaine de la Prade Chardonnay combines fresh tones of citrus and apple with a touch of pear and a round butteriness. Domaine de la Prade Chardonnay is matured for 12 months before being gently liberated from alcohol. Alc 0.0%, 750ml.",,,,,diceys,https://diceys.com,seller
7,Maisels Weisse Non Alcoholic Bottle,,,Other,,,1.99,EUR,Ireland,https://diceys.com/onlinestore/shop/product/maisels-weisse-non-alcoholic-bottle,https://diceys.com/wp-content/uploads/2021/01/maisels-weisse-bottle-non-alcoholic-@-diceys-off-licence.jpg,Maisel’s Weisse “Alkoholfrei” is a deep amber in colour and is jam packed with fruity banana flavours. Its balanced flavour and creamy taste make it very easy to drink. 500ml bottle,,,,,diceys,https://diceys.com,seller
8,Eisberg Cabernet Sauvignon Non Alcoholic,,,Wine,,,7.99,EUR,Ireland,https://diceys.com/onlinestore/shop/product/eisberg-cabernet-sauvignon-non-alcoholic,https://diceys.com/wp-content/uploads/2021/01/eisberg-cabernet-sauvignon-non-alcoholic-@-diceys-off-licence.jpg,"A rich premium non alcoholic red wine with a deep ruby colour and an aroma of cherries & plums, this wine goes brilliantly with lamb or beef. 750ml",,,,,diceys,https://diceys.com,seller
9,Eins Zwei Riesling Non Alcoholic,,,Wine,,,11.99,EUR,Ireland,https://diceys.com/onlinestore/shop/product/eins-zwei-riesling-non-alcoholic,https://diceys.com/wp-content/uploads/2021/01/eins-reisling-non-alc-@-diceys-off-licence.jpg,"Clean and fresh with notes of lime and citrus; surprisingly rhubarb and a little hint of red apples on an underlying mineral base. The finish is dry and long. Extremely close to the depth, structure and weight of a normal wine.0% Alc..750ml",,,,,diceys,https://diceys.com,seller
10,Kopparberg Mixed Fruit Non alcoholic,,,Cider,,,1.99,EUR,Ireland,https://diceys.com/onlinestore/shop/product/kopparberg-mixed-fruit-non-alcoholic,https://diceys.com/wp-content/uploads/2021/01/kopperberg-mixed-fruits-non-alcoholic-@-diceys-off-licence.jpg,The experienced cider makers at Kopparberg have put their efforts into going alcohol free and have been rewarded with this fantastic Mixed Fruits Cider. Raspberry and blackcurrant flavours burst from this cider giving it a rich and indulgent energy. It’s the perfect fruity refreshment for any occasion. 500ml Bottle,,,,,diceys,https://diceys.com,seller
11,Nosecco Alcohol Free Prosecco,,,Wine,,,7.99,EUR,Ireland,https://diceys.com/onlinestore/shop/product/nosecco-alcohol-free-prosecco,https://diceys.com/wp-content/uploads/2021/01/nosecco-non-alco-@-diceys-off-licence.jpg,"Nosecco is a non alcoholic sparkling alternative to Prosecco that looks just like any other bottle of fizz. Once in the glass it has a similar pale golden colour and the same fizz consistencies that you would expect in a sparkling wine. It is slightly sweeter than the average, but definitely a great party starter. 750ml bottle",,,,,diceys,https://diceys.com,seller
12,Leitz Zero Point Five Alcohol Free Cabernet Sauvignon,,Eins Zwei,Wine,,,12.99,EUR,Ireland,https://diceys.com/onlinestore/shop/product/leitz-zero-point-five-alcohol-free-cabernet-sauvignon,https://diceys.com/wp-content/uploads/2023/02/Leitz_Non_Alcoholic_Cabernet_Sauvignon_Dicey_Reillys.jpg,"The Leitz zero alcohol cabernet sauvignon offers hints of ripe cassis and berry flavours as well as dark cherry flavour and aromas of black cherries, blueberries and chocolate with soft tannins and a dry finish. Research has proven the antioxidant and cholesterol fighting effects of drinking red wine, and the Leitz cabernet sauvignon offers these with the added benefit of zero alcohol. 0% Alc/750ml.",,,,,diceys,https://diceys.com,seller
13,Peroni Non Alcoholic 4x330ml bottle,0.0%,,Alternative,,,6.00,EUR,Ireland,https://diceys.com/onlinestore/shop/product/peroni-non-alcoholic-4x330ml-bottle,https://diceys.com/wp-content/uploads/2021/01/peroni-non-alcoholic-@-diceys-off-licence.jpg,"Zero Alcohol, Pure Style. Peroni Libera 0.0% is a light-bodied non-alcohol alternative for those who want to live their week fully without compromise. Peroni Libera 0.0% offers a refreshing and crisp taste with a fine bitterness and a fast and clean finish. 4x330ml bottle",,,,,diceys,https://diceys.com,seller
14,Eins Zwei Zero Sparkling Riesling Non Alcohol,0.0%,,Wine,,,14.99,EUR,Ireland,https://diceys.com/onlinestore/shop/product/eins-zwei-zero-sparkling-riesling-non-alcohol,https://diceys.com/wp-content/uploads/2023/02/Eins_Zwei_Zero_Sparkling_Reisling_Dicey_Reillys-2.jpg,"Eins Zwei Zero is an impressively moreish alcohol-free Sparkling Riesling, with flavours of citrus and rhubarb and an aromatic touch of lime. To remove the alcohol from the wine, a gentle vacuum distillation has been used in order to preserve the natural Riesling flavours. This modern technique has been chosen because it allows the extraction of alcohol under extremely low pressure and temperature (around 30°C). No flavour is lost through the treatment of the wine through the de-alcoholisation process. 0.0%/750ml",,,,,diceys,https://diceys.com,seller
15,Stiegl Freibier Non Alcohol,0.0%,Stiegl,Beer,,,2.20,EUR,Ireland,https://diceys.com/onlinestore/shop/product/stiegl-freibier-non-alcohol,https://diceys.com/wp-content/uploads/2023/02/Stiegl_0.0_Non_Alcohol_Dicey_Reillys.jpg,"Unfiltered and non-alcoholic. Stiegl-Freibier stands out through its full-bodied, balanced taste. Aromatic Austrian Saphir hops lend the unfiltered, nonalcoholic beer in a refreshing, lime-like taste. 0.0%Alc/500ml bottle.",,,,,diceys,https://diceys.com,seller
16,Eisberg Chardonnay Non Alcoholic,,,Other,,,7.99,EUR,Ireland,https://diceys.com/onlinestore/shop/product/eisberg-chardonnay-non-alcoholic,https://diceys.com/wp-content/uploads/2021/01/eisberg-chardonnay-non-alcoholic-@-diceys-off-licence.jpg,"Eisberg created this fresh, crisp Chardonnay just for you. It has hints of lemon, ripe peaches, and soft vanilla, and has had the alcohol carefully removed making it perfect for you to enjoy at any time. 750ml",,,,,diceys,https://diceys.com,seller
17,Hollow Legs Non Alcohol Cabernet Sauvignon,,,Wine,,,12.00,EUR,Ireland,https://diceys.com/onlinestore/shop/product/hollow-legs-non-alcohol-cabernet-sauvignon,https://diceys.com/wp-content/uploads/2025/08/Hollow-Legs-Non-Alcohol-Cabernet-Sauvignon.jpg,"Hollow Leg is an Irish-founded company specializing in high-quality, alcohol-free wines that offer a satisfying alternative to traditional alcoholic beverages. Collaborating with Galician winemaker Pablo Martinez, Dublin restaurateur Jamie O’Toole, and WineLab, they have developed a range of wines that preserve the mouthfeel, taste, and aroma of premium grapes without the need for added sugars or artificial additives. Their offerings include Albariño, Cabernet Sauvignon, Sparkling White Cuvée, and Sparkling Rosé, each crafted to provide a refreshing and enjoyable experience. Notably, each 150ml glass contains only 0.4g of sugar and 9 calories, making them a mindful choice for those seeking to reduce alcohol consumption without compromising on taste.",,,,,diceys,https://diceys.com,seller
18,Non Alcohol Nozeco Still Chardonnay,,Nozeco,Aperitif,,,6.99,EUR,Ireland,https://diceys.com/onlinestore/shop/product/non-alcohol-nozeco-still-chardonnay,https://diceys.com/wp-content/uploads/2024/10/Nozeco_Chardonnay_Dicey_Reillys.jpg,"Its crystal colour with golden reflections, its expressive and charming nose, mixing perfumes of white flowers, citrus fruits and yellow fruits will charm you. With its subtle hints of citrus fruit and floral aroma, this very refreshing Nozeco Still White will perfectly pair with a lovely aperitif or dessert.",,,,,diceys,https://diceys.com,seller
19,Lervig No Worries Non Alcohol Craft Beer,0.5%,Lervig,Beer,,,2.60,EUR,Ireland,https://diceys.com/onlinestore/shop/product/lervig-no-worries-non-alcohol-craft-beer,https://diceys.com/wp-content/uploads/2023/02/Lervig_No_Worries_Non_Alcohol_Dicey_Reilly.jpg,"Need a worry free alcohol free beer? We got it for you. A lightly hopped and pleasantly refreshing pale ale, fermented with a brewers yeast which cant ferment Maltose. Tasting like a low abv beer due to this process you can enjoy the beer without the effect. 0.5% ALC/330ml can.",,,,,diceys,https://diceys.com,seller
20,Eisberg Sparkling Rose Non Alcoholic,,,Wine,,,8.00,EUR,Ireland,https://diceys.com/onlinestore/shop/product/eisberg-sparkling-rose-non-alcoholic,https://diceys.com/wp-content/uploads/2021/01/eisberg-sparkling-rose-@-diceys-off-licence.jpg,"Celebrate with great sparkling wine without the alcohol, meaning you can drive home safely and wake up feeling fresh and ready to go.",,,,,diceys,https://diceys.com,seller
21,Lucky Saint,0.5% ABV,Lucky saint,Other,,,2.00,EUR,Ireland,https://diceys.com/onlinestore/shop/product/lucky-saint,https://diceys.com/wp-content/uploads/2025/07/Lucky_Saint_Alcohol_free.jpg,"Superior Unfiltered Lager. A classic lager made with four natural ingredients – Pilsner Malt, Hallertau Hops, spring water and classic lager yeast. Vegan, 53 Calories Per Lager, 0.5% ABV",,Vegan,,,diceys,https://diceys.com,seller
