,name,abv,producer,product_category,energy,sugar,price,currency,country,url,images,description,gluten_free,vegan,duplicateWith,percentDuplication,site_name,site_url,seller,extras
1,Le Mixer by Monin Mojito Mint plastic bottle - France - Mixers,0 ABV %,Georges Monin,Mixer,660 kJ / 158 kcal,31 g/l,21.87,EUR,Finland,https://www.alko.fi/en/products/901918/le-mixer-by-monin-mojito-mint-plastic-bottle,"https://images.alko.fi/images/cs_srgb,f_auto,t_products/cdn/901918/le-mixer-by-monin-mojito-mint-plastic-bottle.jpg",Le Mixer by Monin Mojito Mint plastic bottle is a  mixer&#x2F;soft drink. Check store availability or buy from the online store.,null,null,null,null,alko,https://www.alko.fi,seller,"{""size"":""1 l""}"
1,"Lime Time Kombucha luomu can - Finland - Water, juice and other non-alcoholic",0.5 ABV %,The Good Guys,Kombucha,90 kJ / 20 kcal,45 g/l,3.68,EUR,Finland,https://www.alko.fi/en/products/957743/lime-time-kombucha-luomu-can,"https://images.alko.fi/images/cs_srgb,f_auto,t_products/cdn/957743/lime-time-kombucha-luomu-can.jpg","Lime Time Kombucha luomu can - Golden-yellow, sweet, fruity, citrus notes, lime notes. Check store availability or buy from the online store.",null,null,null,null,alko,https://www.alko.fi,seller,"{""size"":""0.33 l""}"
2,"Lyre's Dark Cane Spirit - England - Water, juice and other non-alcoholic",0.5 ABV %,Lyre's,Spirit,60 kJ / 10 kcal,27 g/l,29.83,EUR,Finland,https://www.alko.fi/en/products/954176/lyres-dark-cane-spirit,"https://images.alko.fi/images/cs_srgb,f_auto,t_products/cdn/954176/lyres-dark-cane-spirit.jpg","Lyre&#39;s Dark Cane Spirit - Dark brown, medium dry, medium-dry, spicy. Check store availability or buy from the online store.",null,null,null,null,alko,https://www.alko.fi,seller,"{""allergens"":""Contains barley."",""size"":""0.7 l""}"
3,Le Sirop de Monin Hazelnut Sugarfree - France - Mixers,0 ABV %,Georges Monin,Mixer,0 kJ / 0 kcal,0 g/l,21.27,EUR,Finland,https://www.alko.fi/en/products/905323/le-sirop-de-monin-hazelnut-sugarfree,"https://images.alko.fi/images/cs_srgb,f_auto,t_products/cdn/905323/le-sirop-de-monin-hazelnut-sugarfree.jpg",Le Sirop de Monin Hazelnut Sugarfree is a  mixer&#x2F;soft drink. Check store availability or buy from the online store.,null,null,null,null,alko,https://www.alko.fi,seller,"{""allergens"":""Contains artificial sweeteners."",""size"":""0.7 l""}"
4,Schweppes Russchian plastic bottle - Finland - Mixers,0 ABV %,Sinebrychoff,Mixer,160 kJ / 38 kcal,94 g/l,4.77,EUR,Finland,https://www.alko.fi/en/products/793958/schweppes-russchian-plastic-bottle,"https://images.alko.fi/images/cs_srgb,f_auto,t_products/cdn/793958/schweppes-russchian-plastic-bottle.jpg",Schweppes Russchian plastic bottle is a  mixer&#x2F;soft drink. Check store availability or buy from the online store.,null,null,null,null,alko,https://www.alko.fi,seller,"{""ingredients"":""Water, sugar, carbon dioxide, acidity regulator E330, flavours, preservative E202, hibiscus- and carrot concentrate"",""fat"":""0 g"",""carbohydrates"":""9 g"",""size"":""1.5 l""}"
5,Schweppes Russchian can - Finland - Mixers,0 ABV %,Sinebrychoff,Mixer,160 kJ / 38 kcal,94 g/l,1.88,EUR,Finland,https://www.alko.fi/en/products/793954/schweppes-russchian-can,"https://images.alko.fi/images/cs_srgb,f_auto,t_products/cdn/793954/schweppes-russchian-can.jpg",Schweppes Russchian can is a  mixer&#x2F;soft drink. Check store availability or buy from the online store.,null,null,null,null,alko,https://www.alko.fi,seller,"{""ingredients"":""Water, sugar, carbon dioxide, acidity regulator E330, flavours, preservative E202, hibiscus- and carrot concentrate"",""fat"":""0 g"",""carbohydrates"":""9 g"",""size"":""0.33 l""}"
6,Nittenauer Le Chauffeur - Germany - Non-alcoholic beer,0.5 ABV %,Nittenauer,Beer,130 kJ / 30 kcal,34 g/l,3.58,EUR,Finland,https://www.alko.fi/en/products/909791/nittenauer-le-chauffeur,"https://images.alko.fi/images/cs_srgb,f_auto,t_products/cdn/909791/nittenauer-le-chauffeur.jpg","Nittenauer Le Chauffeur - Brownish-yellow, full-bodied, strongly hopped, cloudy, fruity, caramel notes. Check store availability or buy from the online store.",null,null,null,null,alko,https://www.alko.fi,seller,"{""allergens"":""Contains barley."",""bitterness"":""45 EBU"",""wort_strength"":""8 °P"",""size"":""0.33 l""}"
7,"Spirits of Virtue Usko Original - Scotland - Water, juice and other non-alcoholic",0 ABV %,Spirits of Virtue,Spirit,66 kJ / 15 kcal,0 g/l,31.48,EUR,Finland,https://www.alko.fi/en/products/901910/spirits-of-virtue-usko-original,"https://images.alko.fi/images/cs_srgb,f_auto,t_products/cdn/901910/spirits-of-virtue-usko-original.jpg","Spirits of Virtue Usko Original - Colorless, brut, grainy notes. Check store availability or buy from the online store.",null,null,null,null,alko,https://www.alko.fi,seller,"{""fat"":""0 g"",""carbohydrates"":""5 g"",""size"":""0.7 l""}"
8,Soolong T-Vino Enjoy Jasmin - Germany - Non-alcoholic sparkling wine,0 ABV %,Soolong,Wine,96 kJ / 23 kcal,48 g/l,13.74,EUR,Finland,https://www.alko.fi/en/products/600009/soolong-t-vino-enjoy-jasmin,"https://images.alko.fi/images/cs_srgb,f_auto,t_products/cdn/600009/soolong-t-vino-enjoy-jasmin.jpg","Soolong T-Vino Enjoy Jasmin - Yellow, medium dry, acidic, citrus notes, peach notes, jasmine notes, green tea notes. Check store availability or buy from the online store.",null,null,null,null,alko,https://www.alko.fi,seller,"{""allergens"":""Contains sulphites."",""fat"":""0 g"",""carbohydrates"":""5 g"",""size"":""0.75 l""}"
