,name,abv,producer,product_category,energy,sugar,price,currency,country,url,images,description,gluten_free,vegan,duplicateWith,percentDuplication,site_name,site_url,seller,extras
1,ACHOUFFE Chouffe 0.4% - 330ml,0.4 %,ACHOUFFE,Beer,null,null,2.82,GBP,UK,https://www.beerritz.co.uk/belgian-beer/chouffe-04_achouffe_12-x-330ml-bottles,http://www.beerritz.co.uk/images/ww/product/9892-mi.jpg,"Low Alcohol Belgain BlondeUNTAPPD SCORE BREWERY INFOBrasserie d'AchouffeTowards the end of the 1970s, Pierre Gobron and Christian Bauweraerts (two brother-in-laws) decided to create their own beer in their own brewery. With initially only a small amount of money available to them (200.000Bfr, less than 5.000€), they started out on what the fans of the brewery call the ‘Chouffe story’. At the beginning its founders thought of it as a hobby, but the brewery developed at such a rate that, one by one, they decided to devote themselves to the adventure full-time. The first ‘brassin’ (brewing mix) of LA CHOUFFE (49 litres) was finished on 27th August 1982. The elves of Achouffe were impatient to discover new countries, and their Dutch cousins were the first to give them a warm welcome. Even today, the Netherlands is the major destination of Achouffe Beers outside Belgium. Nowadays, more than 20 countries worldwide are supplied with our ‘nectar’ from the Ardennes forests. Coveted international awards have also been received year after year to reward their unique taste. At the end of the summer of 2006 the founders of the Brewery chose to entrust the future of their dear elves to the Duvel Moortgat Brewery. The group’s wish is to invest in Achouffe and to develop the full potential of the BreweryBRASSERIE CHOUFFE WEBSITE",null,null,null,null,beerritz,https://www.beerritz.co.uk,seller,"{""size"":""330ml""}"
2,ACHOUFFE Chouffe Alcohol Free - 330ml,0.4 %,ACHOUFFE,Beer,null,null,2.66,GBP,UK,https://www.beerritz.co.uk/belgian-beer/chouffe-alcohol-free_achouffe_24-x-330ml-bottles,http://www.beerritz.co.uk/images/ww/product/7821-mi.jpg,"Discover a new beer that does have the unique flavour of Chouffe (which gnomes just go crazy for) but that doesn’t have any alcohol in it. With Chouffe Alcohol-Free, everyone can enjoy a great, carefree time, no matter the occasion.UNTAPPD SCORE BREWERY INFOBrasserie d'AchouffeTowards the end of the 1970s, Pierre Gobron and Christian Bauweraerts (two brother-in-laws) decided to create their own beer in their own brewery. With initially only a small amount of money available to them (200.000Bfr, less than 5.000€), they started out on what the fans of the brewery call the ‘Chouffe story’. At the beginning its founders thought of it as a hobby, but the brewery developed at such a rate that, one by one, they decided to devote themselves to the adventure full-time. The first ‘brassin’ (brewing mix) of LA CHOUFFE (49 litres) was finished on 27th August 1982. The elves of Achouffe were impatient to discover new countries, and their Dutch cousins were the first to give them a warm welcome. Even today, the Netherlands is the major destination of Achouffe Beers outside Belgium. Nowadays, more than 20 countries worldwide are supplied with our ‘nectar’ from the Ardennes forests. Coveted international awards have also been received year after year to reward their unique taste. At the end of the summer of 2006 the founders of the Brewery chose to entrust the future of their dear elves to the Duvel Moortgat Brewery. The group’s wish is to invest in Achouffe and to develop the full potential of the BreweryBRASSERIE CHOUFFE WEBSITE",null,null,null,null,beerritz,https://www.beerritz.co.uk,seller,"{""size"":""330ml""}"
3,BIG DROP BREWING CO Galactic Milk Stout - 330ml,0.5 %,BIG DROP BREWING CO,Beer,null,null,2.36,GBP,UK,https://www.beerritz.co.uk/uk-beer/galactic-milk-stout_big-drop-brewing-co_12-x-330ml-cans,http://www.beerritz.co.uk/images/ww/product/1461-mi.jpg,"With notes of coffee, cocoa nibs and a lingering hint of sweet vanilla this beer is dark, rich and indulgent. We keep ours in the fridge but take it out about an hour or so before we drink it as all that decadence needs a bit of warming up. We pour it fast into a tulip glass so the gorgeous coffee aromas can stretch their legs. If it's early in the evening, an oyster or two sets it off nicely. If it's later, a chocolate fondant rounds off this truly extravagant beer.UNTAPPD SCORE 2.82 BREWERY INFOBIG DROP - Big Drop was launched in October 2016 by the-then City lawyer Rob Fink, along with his school-friend/band-mate, designer and entrepreneur, James Kindred. The idea for a brewing business that only made alcohol-free beer was driven by their own lifestyle changes (eg fatherhood) and the frustration that there were no good alcohol-free beer options.Along with renowned experimental brewer, Johnny Clayton (formerly of Wild Beer Co), they’ve perfected techniques to make alcohol-free craft beer without the need for artificial removal of alcohol. The result doesn’t compromise on taste and yet is no more than 0.5% ABV. Big Drop doesn’t just use barley. It uses barley, rye, wheat and oats to give great flavour and aroma. And it doesn’t use just one type of each. Across its beers, it uses over 20 speciality grains. Its wide-range of beers includes Stout, Lager, Pale Ale, IPA, Brown Ale, Golden Ale, Winter Ale and a Sour. So there really is something for everybody.",null,null,null,null,beerritz,https://www.beerritz.co.uk,seller,"{""size"":""330ml""}"
4,BIG DROP BREWING CO Paradiso Citra IPA - 330ml,0.5 %,BIG DROP BREWING CO,Beer,null,null,2.36,GBP,UK,https://www.beerritz.co.uk/uk-beer/paradiso-citra-ipa_big-drop-brewing-co_12-x-330ml-cans,http://www.beerritz.co.uk/images/ww/product/2191-mi.jpg,"This will delight if you’re a fan of fruity, crisp beers. Pale in colour but robust in flavour and very refreshing. Expect a large fruit juice aroma with lime, grapefruit and a hint of spiciness. A delicate blend of mango, passion fruit and pineapple flavours, combined with a light, crisp refreshing body, finishing with a smooth caramel aftertaste.UNTAPPD SCORE 3.04 BREWERY INFOBIG DROP - Big Drop was launched in October 2016 by the-then City lawyer Rob Fink, along with his school-friend/band-mate, designer and entrepreneur, James Kindred. The idea for a brewing business that only made alcohol-free beer was driven by their own lifestyle changes (eg fatherhood) and the frustration that there were no good alcohol-free beer options.Along with renowned experimental brewer, Johnny Clayton (formerly of Wild Beer Co), they’ve perfected techniques to make alcohol-free craft beer without the need for artificial removal of alcohol. The result doesn’t compromise on taste and yet is no more than 0.5% ABV. Big Drop doesn’t just use barley. It uses barley, rye, wheat and oats to give great flavour and aroma. And it doesn’t use just one type of each. Across its beers, it uses over 20 speciality grains. Its wide-range of beers includes Stout, Lager, Pale Ale, IPA, Brown Ale, Golden Ale, Winter Ale and a Sour. So there really is something for everybody.",null,null,null,null,beerritz,https://www.beerritz.co.uk,seller,"{""size"":""330ml""}"
5,BITBURGER Drive - 500ml,0.0 %,BITBURGER,Beer,null,null,2.02,GBP,UK,https://www.beerritz.co.uk/german-beer/drive_bitburger_24-x-500ml-cans,http://www.beerritz.co.uk/images/ww/product/5221-mi.jpg,"Bitburger Premium Pils Drive Alkoholfrei – a refreshingly light, delicious and smooth beer. Its aroma gives a hint of honeyed hops, with a mellow citrus flavour and a hint of subtle spices. Its subtle hoppiness creates a delicious, lingering aftertaste that keeps you coming back for more. It’s a beer you can truly savour. As a zero alcohol beer, it provides all the deliciousness of the original pilsner taste with the added benefit of avoiding the sometimes unpredictable effects of alcohol consumption. A perfectly balanced pilsner with a touch of elegance – that’s Bitburger Premium Pils Drive Alkoholfrei!UNTAPPD SCORE2.36 BREWERY INFOBraurei BitburgAs a family business with over 200 years of brewing tradition, we have been committed to the highest quality since 1817. Keeping this promise of quality makes our beer unmistakable and its taste so unique. Whether first-class sealed hops, the purest deep water or the best malting barley: we know that it is the careful selection of the raw materials that decisively determines the quality of our Bitburger Premium Pils. For incomparable enjoyment - with every sip.VISIT THE BITBURGER BREWERY WEBSITE",null,null,null,null,beerritz,https://www.beerritz.co.uk,seller,"{""size"":""500ml""}"
